,IMG_PATH,MEME_CAPTION
8872,batman-is-sad,Leave robin in charge tonight they said what could possibly go wrong they said
8873,batman-is-sad,affleck that's it
8874,batman-is-sad,THAT is just  fucking stupid.
8875,dwight-from-the-office,You Bully Me To Look Cool? False.  You Bully Me Because You are Insecure and Have Low Self Esteem.
8876,dwight-from-the-office,FOD Walkdown? I Think it's POOP time...
8877,dwight-from-the-office,Happy Birthday FALSE. your birthday was 25 years ago
8878,dwight-from-the-office,"love is in the air? false. nitrogen, oxygen, argon and carbon dioxide is in the air"
8879,dwight-from-the-office,"basketball is the best sport ever? false, explain quidditch"
8880,nahmsayn,I'M GUNNA COME AT YOU IF YA KNOW WHAT I MEAN?
8881,nahmsayn,"alright bratkilla, its enough NAHMSAYN"
8882,nahmsayn,NAHMSAYN
8883,nahmsayn,ALL DAY NAHMSAYN
8884,nahmsayn,INADABUTT NAHMSAYN
8885,funnyjunk-meme,someone doesn't like nutella kill yourself
8886,funnyjunk-meme,Thumb up or down I'm fine either way it's a post about his dead grandma
8887,funnyjunk-meme,"Sees pretty girl in post thumbs, friends, and subscribes"
8888,funnyjunk-meme,REPOST STUFF FROM 9GAG SAYS THAT EVERYONE ELSE DID
8889,funnyjunk-meme,"""4chan is full of nerdy virgins"" 14 year old pokemon fan"
8890,beemomeme,i like to play compy's castle
8891,beemomeme,And i was like.. suck my dick bitch
8892,beemomeme,its bathtime get nakey
8893,beemomeme,more cheats? I see...
8894,beemomeme,Finn and jake just played me Fuck them.
8895,typical-paladin,büszke vagyok arra amit elértem a wowban
8896,typical-paladin,/cast divine shield /use hearthstone
8897,typical-paladin,Born to love. live for joy.
8898,typical-paladin,Matt Haldeman Is addicted to world of warcraft
8899,typical-paladin,get sapped  bubble and hearth!!
8900,typical-bobby,"Shut up, idjits"
8901,typical-bobby,Adolf Hitler Good Man  Candidate. Jose Lopez Albany N.Y.
8902,typical-bobby,NOOOOO!!!!!
8903,typical-bobby,god made the remington rifle  to fight off the homosexuals
8904,typical-bobby,who these other niggers?
8905,ap-crocodile,apush learning about how americans are dicks
8906,ap-crocodile,apush fear failing exam worse than mclellan failed at being a general
8907,ap-crocodile,AP Calc Ab 5 day welcome back test
8908,ap-crocodile,ap environamental science plead teacher to let us have field trip to see the lorax
8909,ap-crocodile,apes no it is not a class about primates
8910,forever-alone-date-myself-fail-life,Go on facebook on birthday 0 new notifications
8911,forever-alone-date-myself-fail-life,I love my wife Auto correct: wifi
8912,forever-alone-date-myself-fail-life,mom tells him to clean his room. Cleans two rooms Thug Life
8913,forever-alone-date-myself-fail-life,logs into facebook after 3 month vacation One notification
8914,forever-alone-date-myself-fail-life,writting 5 sms to different people no ones anweres
8915,ben-likes,you fucked my mom? i hope you made me a little bro
8916,ben-likes,Not Pregnant I can Fix that
8917,ben-likes,even when it's freezing it doesn't shrink
8918,ben-likes,come at me bro
8919,ben-likes,brushing my teeth means i'm wanking
8920,nasty-rita,spill water on floor  don't clean. wait for it to evaporate.
8921,nasty-rita,feeding bottle to baby might as well fap while i'm at it!
8922,nasty-rita,guy ask me to clean room hang dirty clothes up
8923,nasty-rita,don't have tampon use toilet seat instead
8924,nasty-rita,"no working shower for a week, get new shower still don't shower."
8925,timofti,gde lucshie tusovshi? la timofti!
8926,timofti,vstreceaite preamo iz moskvi timofti & dj ghimpy
8927,timofti,vstreceaite preamo iz moskvi timofti & dj ghimpi
8928,timofti,WELCOME TO SAN TROPEZ
8929,timofti,
8930,aww-yiss,birdarm awww yeeee
8931,aww-yiss,AWW YISS MUTHAFUCKIN OP
8932,aww-yiss,Call me crazy At least you call me
8933,aww-yiss,Aww Yeah muthafuckin titties
8934,aww-yiss,thunderstorms aww yeee
8935,truenerd,insists that being a nerd is actually cool will continue to insist on this
8936,truenerd,Girl accidentally touch his hand JIZZ IN HE'S PANTS
8937,truenerd,being nerd multiplies your chances to have sex by 3 0 x 3 = 0
8938,truenerd,Buy new bookshelf.. Already full.
8939,truenerd,IS DAS WIRKLICH MEWTRI? KRasse scheiße
8940,marvel-approve,Marvel  APPROVE
8941,marvel-approve,Cant believe They think im straigh
8942,marvel-approve,Bitches please
8943,marvel-approve,Marvel Sounds like marble
8944,marvel-approve,Glimmer with Cato? Orphan Girl You'll do.
8945,ramirez-do-something,RAMIREZ! Take out THAT PAVE LOW WITH THIS bagel
8946,ramirez-do-something,i used to give orders to ramirez   then i took an arrow in the knee
8947,ramirez-do-something,ramirez! simply walk into mordor!
8948,ramirez-do-something,ramirez! stop being black
8949,ramirez-do-something,rAMIREZ! Take out that ac130 with this spork
8950,pokemon-idiot,Why won't mew Evolve into Mewtwo
8951,pokemon-idiot,649 pokemon? When the fuck did that happen?
8952,pokemon-idiot,Plays pokemon for the first time says it copied bakugan
8953,pokemon-idiot,Throws Pokeball At Rocket Pokemon DON'T BE A THEIF
8954,pokemon-idiot,friends give him all of the legendary pokemon he releases them
8955,eraqus-knows-best,somebody created a xehanort meme must be the darkness
8956,eraqus-knows-best,Too Bright must be the darkness
8957,eraqus-knows-best,"Xehanort has been attacking you with shadows and summoned demons? Nah, he's too nice of a guy to be an evil overlord."
8958,eraqus-knows-best,versus cancelled? must be the darkness
8959,eraqus-knows-best,versus delayed? it's xehanort's fault
8960,the-enforcer,girl asks if he can get weed pretends to make a call
8961,the-enforcer,mom said be home at 5 came home at 5:30
8962,the-enforcer,"He came, He saw, He called for a ride home"
8963,the-enforcer,HEY WAL
8964,the-enforcer,saw a cute girl pretended to be on cell phone
8965,sad-troll,Trolls... ...can't see past 30 fps
8966,sad-troll,sad troll is sad
8967,sad-troll,GOT TROLLED STOPS TROLLING
8968,sad-troll,Hello
8969,sad-troll,SOMEONE FORGOT TO LOG OUT HER FACEBOOK account already on timeline
8970,animeshnik-otaku-narutofan,ナルトと一緒に行き！ Nanda too!!!
8971,animeshnik-otaku-narutofan,want to feel the power of my imaginary rasengan?
8972,animeshnik-otaku-narutofan,I'm so japanese I shit katanas
8973,animeshnik-otaku-narutofan,jiraya YOUR MY FRIend right? be my boyfriend
8974,animeshnik-otaku-narutofan,todavía
8975,sentimental-idiot,He said my story was cool Then he called me a Bro
8976,sentimental-idiot,WENT ON THE ROOF GOT STUCK
8977,sentimental-idiot,i was in the crowd when metallica said we were a great crowd i felt that we really connected
8978,sentimental-idiot,
8979,sentimental-idiot,
8980,navalnytip,economic meal in the cantine carlos silva becomes famous
8981,navalnytip,If you are into Foss you have to join Greeklug
8982,navalnytip,first things first ssh access to simosx
8983,navalnytip,I says.... BITCHHHHHHH
8984,navalnytip,you filthy whore away with thee
8985,tooler-oakley,Everything about the gay community that makes me feel alienated In one shrill package
8986,tooler-oakley,"""Calling IT racist"" ""IS RACIST WITHIN ITSELF"""
8987,tooler-oakley,"Finds text post from a random blog. Responds as if it is a personal attack.   Posts two days later: “It’s just Tumblr, Don’t take it so seriously :)”"
8988,tooler-oakley,"Claims he's a second class citizen is white, male, and has a college degree"
8989,tooler-oakley,"""I hate everyone on the internet"" ""omg i would be lost without tumblr and twitter and youtube i love the internet!"""
8990,teacher-of-computer-science,Password: god
8991,teacher-of-computer-science,Teachers Be Like If i had any F's to give i would Give them To You
8992,teacher-of-computer-science,Lecture Slides? I don't believe in lecture slides
8993,teacher-of-computer-science,and as you can see ...youre asleep
8994,teacher-of-computer-science,kid's about as useful as a bikini at a nudist beach
8995,terra,passed not touching my ears
8996,terra,"this pic sucks hitmonchan's original ""terra"" meme was miles better"
8997,terra,"Guys and Gals, make sure your clothing is appropriate So you can avoid these kinds of stares"
8998,terra,ספר לי  ילד חנון
8999,terra,Spyders  New uc3 character
9000,coworker-cow,Dudh na khele  hobena valo chele
9001,coworker-cow,"Don't have a cow man! really, please don't"
9002,coworker-cow,Dates Everyone
9003,coworker-cow,in bathroom for half an hour
9004,coworker-cow,PERSONAL HYGIENE NOT NECESSARY APPARENTLY
9005,ewan-face,its a ewan thing
9006,ewan-face,y = mx + c Dolphin?
9007,ewan-face,if i hit my tooth with a rock will it go streight haha not falling for that one again
9008,ewan-face,I dun stole metro off bus im a real bad ass
9009,ewan-face,live in ghetto?! but bnp sign up!!!
9010,nice-white-girl,but i'm not racist why are you being so mean to me?
9011,nice-white-girl,i'm not racist i have a friend who's black
9012,nice-white-girl,why can't i use the n word?
9013,nice-white-girl,i don't see color
9014,nice-white-girl,why should my race be part of my identity?
9015,manelistul-nicolae-guta,asa tati dăi!!
9016,manelistul-nicolae-guta,La ce îți trebuie SWAG??? Când ai șucărime ?!?
9017,manelistul-nicolae-guta,La ce îți trebuie SWAG??? CÂND AI ȘUCĂRIME?!?
9018,manelistul-nicolae-guta,Omul nu este un cerc cu un singur centru; e o elipsa cu doua focare: faptele si ideile
9019,manelistul-nicolae-guta,pitagora e fraier n
9020,regretting-panda,hooked up with girl lost her number
9021,regretting-panda,i was born cute i regret nothing
9022,regretting-panda,Why Didn'T i audition for kung fu panda??!!!
9023,regretting-panda,make perfect project get f
9024,regretting-panda,make perfect project get f
9025,8th-grade-9gagger,Haha it's funny because he's fat!
9026,8th-grade-9gagger,tries to force a new meme posts it on 9gag
9027,8th-grade-9gagger,Username or Password incorrect TELL ME WHICH ONE YOU SON OF A ILL
9028,8th-grade-9gagger,The ASIAN INSIDE
9029,8th-grade-9gagger,ALBINO POLAR BEARS ARE BLACK
9030,creepy-camera-man,women's restroom? you mean my office
9031,creepy-camera-man,RAPE? LET'S FILM IT.
9032,creepy-camera-man,wait remove all of your clothes
9033,creepy-camera-man,wanna be famous?
9034,creepy-camera-man,i'll be the last thing you ever see.
9035,lady-gaga-blue-hair-meme,Who Run the world? me. LOL
9036,lady-gaga-blue-hair-meme,bullied in school  by rich girls for not affording designer purses become richer and more sucessful than all of them
9037,lady-gaga-blue-hair-meme,"""telephone"" to be continued i didn't say when"
9038,lady-gaga-blue-hair-meme,gets dropped by def jam releases a 14 minut video that slays every video ever made by an artist under def jam
9039,lady-gaga-blue-hair-meme,"welcome to the monster pit peace, love, and death"
9040,alcohol-mentor,Gyula Force
9041,alcohol-mentor,YOU CAN FIGHT TRUST US
9042,alcohol-mentor,"Алкаш 1 уровня: ""проснулся"
9043,alcohol-mentor,Long island ice tea 1
9044,alcohol-mentor,I'll do anything For a bourbon
9045,mattnisi,cut holes in my pockets easy accss
9046,mattnisi,"kid bikes by ""was that kid a cop?"""
9047,mattnisi,brogrammer
9048,mattnisi,BROGRAMMER
9049,mattnisi,I'm a total fag
9050,zombie,"Hey I just met you, and this is crazy but i'm on bath salts, your face looks tasty"
9051,zombie,Talk shit  get bit
9052,zombie,"Hey, I just met You, and this is crazy, But here's some bath salts. Your face is tasty."
9053,zombie,CAN I HOLD HER
9054,zombie,I LIKE TURTLES
9055,contradiction-cris,Claims sovereignty over Falklands Sells the Andes to Barrick Gold
9056,contradiction-cris,I PUT THE COUNTRY'S MONEY ON FAST CUTTING
9057,contradiction-cris,Let's go out for brEakfast Amm nammm nammmm
9058,contradiction-cris,I hate racism and chinese people
9059,contradiction-cris,LOL WUT
9060,mario-balotelli-serious-face,why always me  i dont want to go to the SYNAGOGUE today mum
9061,mario-balotelli-serious-face,have you seen my serious face?
9062,mario-balotelli-serious-face,Have you seen my serious face?
9063,mario-balotelli-serious-face,all your abs r belong 2 me
9064,mario-balotelli-serious-face,U MAD BRO?
9065,ibs-ibis,"""Gluten"
9066,ibs-ibis,hey i brought burgers home .... oh
9067,ibs-ibis,my favorite game is five roommates one bathroom
9068,ibs-ibis,"Steals sausage from Childs hotdog using  LONG BEAK, now known as"
9069,ibs-ibis,Favorite food is new trigger food
9070,fucking-teammates,Fucking Teammates is bad mkay
9071,fucking-teammates,Loves... Fucking teammates
9072,fucking-teammates,fucking teammates fucking teamates
9073,fucking-teammates,gets killed on modern warfare 3 fucking teammates
9074,fucking-teammates,gets eliminated first in wwe12 throws controller off the wall
9075,avengers-pointing,"Stop, Teeks! Why are you not studying?!"
9076,avengers-pointing,yOu should be looking for a job
9077,avengers-pointing,Who's awesome? you are.
9078,avengers-pointing,"Stop that, Teeks! You should be studying!"
9079,avengers-pointing,"Rob, Happy Birthday!"
9080,davie-iii,Like bitch get bakc bitch get bakc ima mac boo .
9081,davie-iii,Plenty of bitches in the lobby they all drinkin n smokin this my typa party .
9082,davie-iii,Tattoos on her kitty .
9083,davie-iii,Look in my eyes n try to feel my pain..
9084,davie-iii,"Bangin tupac ,  cause i got ambitions of a rida ."
9085,hot-jew-girl,Don't worry I'm kosher
9086,hot-jew-girl,just wait until you see my yamacah
9087,hot-jew-girl,how about you and i make the sea cum alive
9088,hot-jew-girl,i judge people by how they react to a jew joke
9089,hot-jew-girl,jewish girls  still like to get dirty
9090,george-fox,Grampah Roy Best wingman ever
9091,george-fox,Sex scene in faith and films? Everyone please loose your shit on the count of three...1...2....ahhh!!!!!
9092,george-fox,That akward moment when you mistake Christopher Benjamin and Jeannot Djanga
9093,george-fox,Quaker school worst. oatmal. ever.
9094,george-fox,I Like My girls how i like my oatmeal HOT AND QUAKER
9095,heartless-harry,Hey Beiber  looks like I am the cure to the fever
9096,heartless-harry,HAHAHAHA ITS A GINGER
9097,heartless-harry,PLEASE PLEASE GET HIM SLENDER MAN
9098,heartless-harry,YA'LL MY BITCHEZ TONIJNTJE
9099,heartless-harry,DID YOU SEE THAT GUYS THAT GIRL JUST GOT PUSHED OVER AND SMASHED HER SKULL IN TWO SHE'S PROBABLY DEAD LOLLLLLLLLLLLLLLLLLLLLLLL
9100,adam-levine,suck my big dick
9101,adam-levine,"hey girl, I heard it's your birthday So i wore my birthday suit to celebrate"
9102,adam-levine,HEY CHAD I NEED YOU TO STUDY RIGHT NOW
9103,adam-levine,adam levine hemorroid transplant survivor
9104,adam-levine,"""ALL ALONE IN MY ROOM THINK OF YOU AT A RATE THAT IS TRULY ALARMING' REMOVE THE ""ALL ALONE"" AND REPLACE ""THINK OF YOU"" WITH ""DOING YOU"""
9105,treiquilimei,NIGGAZ BE LIKE CAN I PICK YOU UP?
9106,treiquilimei,NIGGAS BE LIKE RIDING AROUND WIT MY TOP DOWN
9107,treiquilimei,"""Team Jimmy"""
9108,treiquilimei,alright who slashed me TIRES?
9109,treiquilimei,buys cheap car to save money has to spend money on new tires constantly because of bad wheel fitment. hella flush!
9110,mckayla-maroney-not-impressed,found out she was a meme not impressed
9111,mckayla-maroney-not-impressed,XBOX  ONE NOT IMPRESSED
9112,mckayla-maroney-not-impressed,chuck norris not impressed
9113,mckayla-maroney-not-impressed,Sorted at hogwarts gets hufflepuff
9114,mckayla-maroney-not-impressed,banged by two eight inch cocks not impressed
9115,i-will-find-you-meme,"I don't know where you are But I will look for you, find the tab your in, and kill your sound video ad"
9116,i-will-find-you-meme,"Alicia, I will find you and wish you a happy birthday"
9117,i-will-find-you-meme,"i don't know who i am but i will find you, and you will tell me."
9118,i-will-find-you-meme,"Whereever you are, whatever you do I will find you and hug you."
9119,i-will-find-you-meme,i don't know who you are but i will find your meme and i will downvote it
9120,wrong-lyrics-christina,I LOVE ROCK AND ROLL A TUNA AND A LIME IN THE JUKEBOX BABY
9121,wrong-lyrics-christina,back to black    say boomerang jack
9122,wrong-lyrics-christina,Shine bright like an almond
9123,wrong-lyrics-christina,keep singing like nananana everyday  just like my eyebrow's stuck and i'm gay
9124,wrong-lyrics-christina,wE FOUND DOVE IN A SOAPLESS PLACE
9125,hurting-henry,please give me the spare key
9126,hurting-henry,please not the stick!
9127,hurting-henry,please  turn down the music
9128,hurting-henry,CAN I PLEASE  SUCK YO DICK?!
9129,hurting-henry,Please Stop recaptioning so many grumpy cat pics. They aren't that funny.
9130,gentrification-giraffe,THERE SO MANY MIDDLE CLASS WHITE PEOPLE MOVING HERE CHALLENGE ACCEPTED
9131,gentrification-giraffe,buys the cheapest coffee from turkish store uses with mocca master
9132,gentrification-giraffe,Complaining about hipsters just bought a fixie
9133,gentrification-giraffe,Cameron is awesome
9134,gentrification-giraffe,ad asd
9135,contradiction-mauri,cristina? ha ha!
9136,contradiction-mauri,cristina? ha ha!
9137,contradiction-mauri,cristina? ha ha!
9138,contradiction-mauri,cristina? ha ha!
9139,contradiction-mauri,cristina? ha ha!
9140,nervy,mardi gras!!!
9141,nervy,die bitch diee
9142,nervy,
9143,nervy,Tem um gang num forum
9144,nervy,"gay party and gay band andré cardoso, João Quintão,Pedro barbola e carlos pereira !"
9145,x-mas-nigger,mas Nigger
9146,x-mas-nigger,mas Nigger
9147,x-mas-nigger,mas Nigger
9148,x-mas-nigger,mas Nigger
9149,x-mas-nigger,mas Nigger
9150,butthurt-dweller-trap,"went outside good graphics, shitty gameplay"
9151,butthurt-dweller-trap,dating? at which level do you unlock that ability?
9152,butthurt-dweller-trap,8.5/10 Wouldn't bang
9153,butthurt-dweller-trap,clitoris? never heard of that pokemon
9154,butthurt-dweller-trap,"I don't shower but when i do, i do it in sims"
9155,vechnoxudeushiy,1 month non stop dancing AND I STILL FAT
9156,vechnoxudeushiy,rob t does know how much it hurts  when he call me skinny
9157,vechnoxudeushiy,So Yeah I Xavier ... I Think I'm Pretty Ripped What Do You Think Ladies !!!
9158,vechnoxudeushiy,So Yeah I'm Xavier... I Think I'm Pretty Ripped What Do You Think Ladies !!!
9159,vechnoxudeushiy,why dont i do mandy
9160,business-dragon,Vending Machine eats dollar eat vending machine
9161,business-dragon,in conclusion to the meeting rawr
9162,business-dragon,Kidnap princess file reports
9163,business-dragon,Fired by boss set boss on fire
9164,business-dragon,Out of staples Eat secretary
9165,harvest-moon,SPEND WEEKS TO MAKE THE PERFECT BIRTHDAY PRESENT Miss birthday
9166,harvest-moon,talks to future husband He only talks about horses
9167,harvest-moon,No roosters eggs hatch anyway
9168,harvest-moon,Cow gives bitrth somehow cain knows before you
9169,harvest-moon,plant expensive pinapples storm next day
9170,typical-nicky-4,his mom asks him to buy groceries so he does.
9171,typical-nicky-4,UM FUCK U BIRDY
9172,typical-nicky-4,cock its whats for dinner
9173,typical-nicky-4,created meme with my own face
9174,typical-nicky-4,y u no showing memes in russian??
9175,glamour-girl,"""I'm not stuck"
9176,glamour-girl,drink soda at the party pretends to be drunk
9177,glamour-girl,LOVEZ BAD BOYZZ WONDERS WHY SHE ALWAYS GETS CHEATED ON ??
9178,glamour-girl,"IF YOU SEE A STOP IT IN THE STORE CALL 242,221,225 AND 226"
9179,glamour-girl,don't worry about simplifying the terminology i've read miller's book on meta
9180,slowpoke,Did you hear that apple guy died?? R.i.p. isaac newton
9181,slowpoke,what's sopa? i should go look it up on wikipedia
9182,slowpoke,Did you guys hear that one steve guy died Those damn stingrays
9183,slowpoke,HEY GUYS I FOUND THIS COOL NEW GAME IT'S CALLED MINECRAFT
9184,slowpoke,I may be slow but i am faster than internet explorer
9185,webberz,uses meme creator pig
9186,webberz,is higher THEN STONER JOE doesn't know what weed is
9187,webberz,NEVER GUNNA GIVE YOU UP  NEVER GUNA GIVE YOU DOWN
9188,webberz,Goes to school knows 10 people in his year
9189,webberz,Butkiss popcorn
9190,pompous-cyber-cat,thinks rap disrespects women listens to combichrist
9191,pompous-cyber-cat,can count in German but only to three
9192,pompous-cyber-cat,doesnt like pop music listens to faderhead
9193,pompous-cyber-cat,check out my new project there's a k in the name instead of a c so you know i'm legit
9194,pompous-cyber-cat,makes fun of          how people dance never dances
9195,there-will-be-blood,i will chug a quart of corn liquor and brain you with a bowling pin
9196,there-will-be-blood,Barbeque Baked Beans? There will be gas!
9197,there-will-be-blood,There will be poop
9198,there-will-be-blood,There will be bugs
9199,there-will-be-blood,i will chug a quart of corn liqour and brain you with a bowling pin
9200,fapper-sky,When im lonely I masturbate
9201,fapper-sky,prepare your anus
9202,fapper-sky,They laughed at Me I fapped in silence
9203,fapper-sky,Pretends to be ur friend Does ur grandma
9204,fapper-sky,Plays guitar doesnt know phrygian
9205,drewcarey,Welcome to iFunny Where everything's a repost and the likes dont't matter
9206,drewcarey,Welcome to fox where there are shitty announcers and we camera rape everyones face
9207,drewcarey,Welcome to black friday tHE HOLIDAY Where elderly women get trampled to death and the employees don't matter.
9208,drewcarey,Welcome to the Pro Bowl The show where everything's made up and the points don't matter
9209,drewcarey,Welcome to LSA The school where everything's made up and the language requirement doesn't matter
9210,uy-si-uy-si-uy,Ay si Ay si Cuando bailo hasta elmer se enamora de mi
9211,uy-si-uy-si-uy,uy si uy si salvis muy US team fans when they play against mexico
9212,uy-si-uy-si-uy,"uy si uy si salvis escojan, la selecta or USA team"
9213,uy-si-uy-si-uy,uy is uy si Muy espaldon el cabron
9214,uy-si-uy-si-uy,"uy si, uy si, COMO ES VIERNES... TODO MUNDO PA'FOX HOLLOW"
9215,jonnen-neuvo,lieksa haisee siel on somaleita
9216,jonnen-neuvo,mustanaamio       lahtaa somali
9217,jonnen-neuvo,Liexas o guulemma somaleid gäyn vedää niid durbaa lol
9218,jonnen-neuvo,jos   annat   äänesi tulet   mykäksi
9219,jonnen-neuvo,mä   oon  proffan    poika Jonne  Neuvo
9220,overly-literal-thinker,Literal Thinker
9221,overly-literal-thinker,Literal Thinker
9222,overly-literal-thinker,Literal Thinker
9223,overly-literal-thinker,Literal Thinker
9224,overly-literal-thinker,Literal Thinker
9225,ajiii,RAKEL CUANDO SE RIE
9226,ajiii,JA BOR I DIN KÄLLARE
9227,ajiii,I heard bananas
9228,ajiii,MMMMMM BANANAS
9229,ajiii,This shit's bananas b
9230,stupid-flirty-kallane,"""that lance embarrasses me and my guild"" Give him same lance in different color"
9231,stupid-flirty-kallane,firm believer in polyamory i better not see her with anyone else
9232,stupid-flirty-kallane,sTRONGEST mAN IN THE WORLD cAN'T PICK UP INFANTILE SON
9233,stupid-flirty-kallane,courting a woman tell her you liked her friend because of her virginity
9234,stupid-flirty-kallane,yell at people in the street cry when it happens to me
9235,nooby-lewis,COMPLAINS ABOUT FLYING TREES LEAVES ONE HANGING
9236,nooby-lewis,WE ARE NOT RETREATING WE ARE ADVANCING IN A DIFFERENT DIRECTION
9237,nooby-lewis,IF YOU KNOW WHO I AM YOU ARE AWSOME
9238,nooby-lewis,Shadow of israphel where is it?
9239,nooby-lewis,try dealing with serious electricity frolick around with a bunny instead
9240,laserbeam898,i'm at that time of month again to make a new account
9241,laserbeam898,Im gweg and i sing on youtwube. chweck mwe owt!
9242,laserbeam898,I rest my case continues to complain
9243,laserbeam898,"Yes, I admit to being 12. NO, i never said that!"
9244,laserbeam898,"if i had a dollar for every account i made, i'd be a millionaire"
9245,daniel-peredo,SI QUISIERAS SHEPUT
9246,daniel-peredo,ales consejo de pata anda comprando vacelina
9247,daniel-peredo,Went to work Got fired
9248,daniel-peredo,You know ure a rs addict when u watch rs vids when u cant play rs
9249,daniel-peredo,
9250,comic-book-addict-penguin,Notice you're the only girl in the comic shop I'm being judged aren't I?
9251,comic-book-addict-penguin,Love a character in one continuity hate them in another
9252,comic-book-addict-penguin,"""There are no girl Robins."" GTFO"
9253,comic-book-addict-penguin,Five Issue Miniseries fifty tie ins
9254,comic-book-addict-penguin,"Friends Love Batman Too Same Friends have never heard of dick grayson, jason todd, tim drake, Barbara gordon, or..."
9255,kill-yourself-guy-blank,Hatred of Islam = freedom of speech Hatred of Jews = Antisemitism Kill yourself
9256,kill-yourself-guy-blank,facebook stop publicizing yourself because no one gives a shit
9257,kill-yourself-guy-blank,EXCUSE ME I DON'T HAVE A SHORT TEMPER I JUST HAVE A QUICK REACTION TO BULLSHIT
9258,kill-yourself-guy-blank,"Don't blame 2016,  Your life was shitty last year too."
9259,kill-yourself-guy-blank,starbucks stop paying $4.00 for a 30 cent cup of coffee
9260,marcos-rosales,has had more dicks in  him than your mother
9261,marcos-rosales,Man... This acid rawks!
9262,marcos-rosales,io mi chiamo andrea e sono molto serio
9263,marcos-rosales,robi w chuj hałasu w nocy nie może spać bo wiatrak komputera pracuje
9264,marcos-rosales,put a fake cockroach in her bed face expression priceless
9265,tha-hipster-seal,DO U THINK MY BREATH SMELLS FISHY?? HAAAAAAAAAAAAAAA
9266,tha-hipster-seal,Club Can't Even Handle Me
9267,tha-hipster-seal,I registered for summer Breakout 2012 in 1999
9268,tha-hipster-seal,I registered for Summer Breakout 2012 in 1991
9269,tha-hipster-seal,I own andy Kulbala's sermons on Vinyl
9270,indigent-sparrow,that guy is flying using a cape? this is not batman or dracula get down here this instant
9271,indigent-sparrow,Need new shoes Make them out of cardbord boxes
9272,indigent-sparrow,нашкребу копеек на булку
9273,indigent-sparrow,swim you better do something smart or my bad breath will scar you for life
