,IMG_PATH,MEME_CAPTION
6153,typical-muser,"is this nme? no, this is q AWARDS."
6154,typical-muser,"uno? NO, YOU IDIOT"
6155,carl-johnson,Tries to put fire out with fire extinguisher  Gets wanted level
6156,carl-johnson,GTA miami Mission 1: Eat face
6157,carl-johnson,doesn't bathe SIX girlfriends
6158,carl-johnson,SAYS YOU HIT MY CAR ISNT HIS CAR
6159,carl-johnson,enters a barbershop without beard out with beard
6160,apathy-dog,ShIt on couch Umadbro?
6161,apathy-dog,Nobody does apathy dog right I guess it's okay though
6162,apathy-dog,normal Bitch want to pet me crazy bitch wanna fuck me
6163,apathy-dog,please?
6164,apathy-dog,"it was raining, had to poop inside first world dog problems"
6165,stevie-wonder,being blind ain't so bad ... ...at least i'm not black!
6166,stevie-wonder,The dress is black  Everything is black
6167,stevie-wonder,lol what if stevie wonder sees this meme?
6168,stevie-wonder,have you seen my wife? what does she look like?
6169,stevie-wonder,i'm sorry i just can't see your point of view
6170,scumbag-atheist,mocks 4 year old child for believing in santa claus
6171,scumbag-atheist,talks like an atheist looks like a pedophile
6172,scumbag-atheist,HATES RELIGION CANT STOP TALKING ABOUT IT
6173,scumbag-atheist,wants atheism respected disrespects faith
6174,scumbag-atheist,I don't have time for you to push your beliefs on me I'm too busy pushing Mine on you
6175,wtf-igc-kushagra,MAin Chutiya hoon
6176,wtf-igc-kushagra,ask female cosplayers to dance masturbate while watching them on cctv
6177,wtf-igc-kushagra,Got money from tickets bought curry
6178,wtf-igc-kushagra,I dont always host an event But When I do I must run for my life
6179,wtf-igc-kushagra,"host rupees 1.5 crore event ""Mukesh, CS 1.6 ka crack kidhar hai?"""
6180,you-have-no-power-here,Seeing your teacher in public You have no power here.
6181,you-have-no-power-here,Mom and dad You have no power here
6182,you-have-no-power-here,Teachers outside of school You have no power here
6183,you-have-no-power-here,makeup department? you have no powder here
6184,you-have-no-power-here,married women your boobs have no power here
6185,bender-blackjack-and-hookers,WE'LL HAVE OUR OWN WORLD CUP WITH BLACKJACK AND HOOKERS
6186,bender-blackjack-and-hookers,We'll make our own server With blackjack and hookers
6187,bender-blackjack-and-hookers,I'll start my own boyscouts with blackjack and hookers
6188,bender-blackjack-and-hookers,i'll coach my own brazil with blackjack and hookers
6189,bender-blackjack-and-hookers,I'll start my own political party with blackjack and hookers
6190,oprah-you-get-a,"You get Ebola, you get ebola Everyone gets Ebola"
6191,oprah-you-get-a,You get a death scene! And you get a death scene! Everyone gets a death scene!
6192,oprah-you-get-a,i am oprah you will all love me and despise me
6193,oprah-you-get-a,"Me On Tinder You Get A like, you get a like, everyone gets a like!!!"
6194,oprah-you-get-a,"YOU GET A DILDO, YOU GET A DILDO, YOU GET A DILDO"
6195,mugatu,Ferguson missouri So hot right now
6196,mugatu,talking about The interview and North korea so hot right now
6197,mugatu,Static
6198,mugatu,Can you get out of the area Between me and my morning coffee?
6199,mugatu,tl;dr; so hot right now
6200,beetlejuice,you can say my name as much as you want i still aint gonna help u move....better call freemoverguy.com
6201,beetlejuice,open my window and the breeze rolls in  i jizz in my pants
6202,beetlejuice,who am i? Say it three times!
6203,beetlejuice,In route
6204,beetlejuice,niggerjuice niggerjuice
6205,judge-judy,I WOULD HAVE INDICTED HILLARY IN A NEW YORK MINUTE
6206,judge-judy,you called me an idiot they will edit that out
6207,judge-judy,"pedo's & satanists in gov't, business, hollywood, etc.. we sentence you to death, at dawn tomorrow"
6208,judge-judy,you calling me a liar?
6209,judge-judy,You're a cunt case dismissed
6210,justin-bieber,has a girlfriend still writes a song about wanting to be your boyfriend
6211,justin-bieber,"sets password as ""mytalent"" password too small"
6212,justin-bieber,welcome to the 21st century where getting to the entertainment industry requires no talent
6213,justin-bieber,Just heard Justin Bieber is having a baby anyone know who the father is?
6214,justin-bieber,claims to have talent gets hit in the face with a bottle.
6215,picard-facepalm,They gave Greece more money To get out of debt
6216,picard-facepalm,Calling someone an idiot and you use your and not  you're
6217,picard-facepalm,she done posted another damn picture of her food
6218,picard-facepalm,That moment when You have 0.1 mb of download left and net disconnects
6219,picard-facepalm,Is it so hard... to use your blinker?
6220,what-do-we-say-to-the-god-of-death-?,What do we say to windows update? not today
6221,what-do-we-say-to-the-god-of-death-?,What do we say to the god of homEwork? Not today
6222,what-do-we-say-to-the-god-of-death-?,And what do we say to the java update? not today
6223,what-do-we-say-to-the-god-of-death-?,What do we say to a wedding invitation from the freys? not today
6224,what-do-we-say-to-the-god-of-death-?,What do we say to the sink full of dishes Not today
6225,in-soviet-russia,in soviet russia music kills rebecca black
6226,in-soviet-russia,in soviet russia justin bieber is still hated by millions
6227,in-soviet-russia,In soviet russia megaupload closes fbi
6228,in-soviet-russia,"In soviet internet, Google search you!"
6229,in-soviet-russia,in soviet russia you rob the bank in capitalist america bank robs you
6230,advice-matt-berninger,miss someone for 29 years without even meeting
6231,advice-matt-berninger,"No, SORRY THATS MY WINE"
6232,advice-matt-berninger,WHY DID YOU LISTEN TO THAT MAN? THAT MAN'S A BALLOON
6233,advice-matt-berninger,I'm afraid of everyone I'M AFRAID OF EVERYONE
6234,advice-matt-berninger,I'm a perfect piece of ass
6235,typical-winx-arter,arter
6236,typical-winx-arter,arter
6237,typical-winx-arter,arter
6238,typical-winx-arter,arter
6239,typical-winx-arter,arter
6240,conspiracy-manke,there are no lemons at this party
6241,conspiracy-manke,WHEN A 40 YEAR OLD MAN WITH NO HAIR SENDS YOU A FRIEND REQUEST ...WITH NO MUTUAL FRIENDS
6242,conspiracy-manke,You mean other players can shoot at me while I'm shooting at them?
6243,conspiracy-manke,what do you mean no fabric softener???
6244,conspiracy-manke,This is my Bestest orgasm face
6245,diagnostic-house,"i heard you had the flu, wait a moment. i'm sorry. you have a brain tumor."
6246,diagnostic-house,i know the problem right away i tell you in last 5 mins of show
6247,diagnostic-house,you have aids gonna cry about it?
6248,diagnostic-house,Is always right nobody believes him till the end of the episode
6249,diagnostic-house,If you could reason with religious people there would be no religious people
6250,serious-snape,"Alan rickman is like bacon. he's not really good for you, but makes everything better."
6251,serious-snape,Going to bed? Mind if I Slytherin?
6252,serious-snape,the awkward moment when i'm still hotter than neville
6253,serious-snape,50 points to Gryffindor for putting up with the ginger
6254,serious-snape,Do not lie to me
6255,angry-cat-meme,i wish we had something between us 'yeah what' a wall
6256,angry-cat-meme,why don't you sing tenor? ten or twelve miles away
6257,angry-cat-meme,what is the worst president joke? Donald Trump
6258,angry-cat-meme,MY FAVORITE DAY IS MONDAY WHY? CAUSE IT GIVES YOU HELL.
6259,angry-cat-meme,Unfriending me Means That I get to Block You!
6260,obsessed-girlfriend,guy holds subway door for her wonders what their kids will look like
6261,obsessed-girlfriend,"you texted me ""lol"" but I didnt see you laugh through your window"
6262,obsessed-girlfriend,MAN I LOVE HORSE SEX
6263,obsessed-girlfriend,boyfriend dumps her she castrates him
6264,obsessed-girlfriend,I read your text messages Who's mom?
6265,serj-tankian,"I don't always cry but when i do, it's because angels deserve to die"
6266,serj-tankian,ah ah ah u didnt say the magic word
6267,serj-tankian,pokemon x sounds like a violent pornagraphy
6268,serj-tankian,a mi no me engañas  borraste el historial
6269,serj-tankian,I'M A WISE GUY THE MESSAGE ON THE BOTTOM IS FALSE THE MESSAGE ON THE TOP IS TRUE
6270,overly-manlyman,Surrounded? you mean we can attack in every direction?
6271,overly-manlyman,"When I was your age We fought with fists, not with caps lock"
6272,overly-manlyman,stab wound? you mean extra pocket?
6273,overly-manlyman,Chuck Norris? Who the hell is she?
6274,overly-manlyman,bulletproof vest? You mean chest hair?
6275,red-terrance,A 13
6276,red-terrance,yeah i'll fight you let me call MICHAEL aka STabsy
6277,red-terrance,got banned from melbourne by topgun jimmy
6278,red-terrance,Women in tashkent have better facial hair than me
6279,red-terrance,Get kicked out before game starts FORZE ADELAIDE
6280,debuilder,Steven Bennett's facebook editing i'm not fat
6281,debuilder,SEE THAT ?
6282,debuilder,i haz abz they cool right?
6283,debuilder,ЧЕМ ОТЛИЧАЕТСЯ
6284,debuilder,wanna get jaked like me? well go to the deca booth and refer jack
6285,kenita-listo-cabros,Listo cabros
6286,kenita-listo-cabros,Succesful
6287,kenita-listo-cabros,LISTO CABROS! HABLÉ CON LOS EX
6288,kenita-listo-cabros,ya cabros nadie se va echar civil II
6289,kenita-listo-cabros,"ya cabros, hablé con bulnes no perdemos el año escolar"
6290,disappointed-tibetan-fox,Your face when you spent an hour creating a presentation but realize you didn't have to
6291,disappointed-tibetan-fox,Reincarnation sucks
6292,disappointed-tibetan-fox,hope and change
6293,disappointed-tibetan-fox,she's a justin bieber fan? are you fucking kidding me?
6294,disappointed-tibetan-fox,did you know that an average person will spend 25 years asleep? really.
6295,foul-frog-couple,first date ends release huge fart as soon as the front door closes
6296,foul-frog-couple,love is not having to hold your farts in anymore
6297,foul-frog-couple,lazy saturday morning on wednesday
6298,foul-frog-couple,"haven't showered, washed, brushed, or shaved anything doesn't matter, had sex"
6299,foul-frog-couple,house sit for friend have sex on every piece of furniture they own
6300,typical-yandere,"hey i just met you, and this is crazy but im gasai yuno, so love me yukkii"
6301,typical-yandere,"did you like my boyfriend? yes, you died."
6302,typical-yandere,"Don't worry,I will protect you by i killing off your friend and family"
6303,typical-yandere,"Do you like my boyfriend? yes, you did."
6304,typical-yandere,Soooooooo Shinny
6305,mtgface,Talk to a Girl Giant Growth
6306,mtgface,lost a $20 magic card? pulled same one in a booster yesterday
6307,mtgface,sends friend across dangerous road to buy food with $5 expects change
6308,mtgface,references magic cards in completely unrelated situation
6309,mtgface,plays ponder scrys 4
6310,creative-brah,nothing's more fun than sharing dreams into reality
6311,creative-brah,let's get to ramp speed brah
6312,creative-brah,"Not 4 Nuthin but you can't eat steak on a McDonalds budget, brah"
6313,creative-brah,"Not 4 Nuthin But the photos should look natural, not cliched or tripe"
6314,creative-brah,not for nothing lets put googley eyes on the hambuger
6315,uke,"Идеальный уке это такой уке, сопротивлением которого в данных условиях можно пренебречь"
6316,uke,"Seme stop, plea"
6317,uke,First you nuke my country now you give me negative votes?
6318,uke,negative votes make me a sad panda
6319,uke,i will obey to my seme
6320,macho-trucker,Needs miles refusing. only goes to laredo
6321,macho-trucker,lube was dripping out of my rear end when the seal failed on my tractor
6322,macho-trucker,They call me  Trucker vee
6323,macho-trucker,hop in back an'we'll be off
6324,macho-trucker,THIS GIRL CAME UP TO ME AND SAID I WANT 12 INCHES AND I WANT IT TO HURT SO I FUCKED HER TWICE AND PUNCHED HER IN THE FACE
6325,ridiculous-rap-lyrics-sea-lion,This is my  seal of approval
6326,ridiculous-rap-lyrics-sea-lion,i jerk off inside books and give life to words
6327,ridiculous-rap-lyrics-sea-lion,triple six is my number you can get it off my tumblr
6328,ridiculous-rap-lyrics-sea-lion,my nickname was creepy
6329,ridiculous-rap-lyrics-sea-lion,i keep shit stinks in my drawers so i can get fzza
6330,irrational-killers-fan,watch the mormon promo video of brandon playing with his babies biological clock has never ticked louder
6331,irrational-killers-fan,"gas leak at cathedral court? sorry about that, i couldn't hold it in much longer..."
6332,irrational-killers-fan,"see ""enjoy coke"" t"
6333,irrational-killers-fan,hermia announces she's not a mod at killers message board anymore hold candlelight vigil
6334,irrational-killers-fan,THE USERNAME 'MRSBRANDONFLOWERS' IS ALREADY TAKEN THREATEN USER TO MAKE BRANDON A WIDOW UNLESS THE USER DELETES THEIR ACCOUNT
6335,rage-fu,installed new program default search changed to bing
6336,rage-fu,Get all Comfy in bed realize lights still on
6337,rage-fu,I SEND LONG TEXT... YOU REPLY WITH' K' ?!
6338,rage-fu,"Didn't do your homework and teacher forgot to tell you to turn it in. Teachers pet says ""teacher what about the homework?"""
6339,rage-fu,Mom yells hurry up go outside and she tells you to wait
6340,family-guy-pepperidge-farm,Remember when girls liked muscular guys?  Pepperidge Farm Remembers
6341,family-guy-pepperidge-farm,"iron maiden cant be fought, iron maiden cant be sought Pepperidge Farm remembers"
6342,family-guy-pepperidge-farm,remember when game developers cared about the players? pepperidge farm remembers
6343,family-guy-pepperidge-farm,Remember when they said we'll bring our troops home? Pepperidge Farm remember
6344,family-guy-pepperidge-farm,REMEMBER WHEN TV WAS FUNNY SETH MACFARLANE REMEMBERS CUZ HE STEALS ALL THOSE OLD JOKES
6345,homophobic-ace,wanting lgbt events and spaces to revolve around lgbt ppl is aphobic
6346,homophobic-ace,thinks asexuals are the most left out in the queer community doesn't get why trans people side eye the shit out of them
6347,homophobic-ace,"""prude,"" ""frigid,"" ""tease"": asexual slurs what's sexism?"
6348,homophobic-ace,The hardest part of being ace is having people assume I'm a lesbian
6349,homophobic-ace,LGBT PPL IDENTIFYING AS LGBT IS AN ASEXUAL PROBLEM
6350,suicide-stewie,WHEN YOU FIND OUT THAT ONE DIRECTION MIGHT HAVE A TV SHOW  I DON'T WANNA LIVE IN THIS WORLD ANYMORE
6351,suicide-stewie,Wait a minute you mean it's Monday again already  I'M OUT!!!!!!!!!
6352,suicide-stewie,Done
6353,suicide-stewie,hey everybody look my impression of kurt cobain
6354,suicide-stewie,im only doing this it's because i caught my dad twerking
6355,so-hardcore-guy,OMG!! BEST COMEBACK EVER
6356,so-hardcore-guy,I PUT HASHTAGS AFTER EVERY POST ON FACEBOOK
6357,so-hardcore-guy,OMG Here's your fucking medal
6358,so-hardcore-guy,OMG Do you want a medal for that shit?
6359,so-hardcore-guy,MIKES HARD LIMEADE
6360,svatko,"SINCERELY YOURS,   Yuriy SVATKO, Dr. of Philology, Professor,  Chairholder of the UNESCO Chair ""Human Rights, Peace, Democracy, Tolerance and International Understanding"" at the National University of ""Kyiv"
6361,svatko,Two goats... For your daughter hand in marriage
6362,svatko,a dry handjob sure sounds good right about now
6363,svatko,what is difference between math and vodka? the more math you learn the more you want drink vodka
6364,svatko,Son of a bitch! That little boasters did it again!!
6365,bad-advice-roommate,"she told you she's pregnant? she's lying bro, you pulled out"
6366,bad-advice-roommate,"Lock the door? Psh, we're fine"
6367,bad-advice-roommate,smoke THIS BOWL YOU'LL STILL HAVE TIME TO STUDY
6368,bad-advice-roommate,need to throw up? USe mesh trashcan!
6369,bad-advice-roommate,computer got stolen? steal someone elses!
6370,furious-jon,ask girl about crytic statement she responds with another cryptic statement
6371,furious-jon,WHY DON'T BURGERS FROM MACDONALDS LOOK LIKE THEIR PICTURE!
6372,furious-jon,WHY ARE ALL SONGS PACHELBEL'S CANON IN D!?
6373,furious-jon,Playing Tetris No Line Pieces
6374,furious-jon,you 're breaking my balls bra
6375,vacantgiraffe,c'mon baby Let's Rub Noses
6376,vacantgiraffe,Tries out for the nba too tall
6377,vacantgiraffe,You mama no
6378,vacantgiraffe,vacant giraffe pic too small
6379,vacantgiraffe,"the sign says ""I'm really a cat"
6380,more-homework-mintchev,Talks to other professors To make everything due the same week
6381,more-homework-mintchev,Remark
6382,more-homework-mintchev,Proof: So so so so so
6383,more-homework-mintchev,there's a hole in my toms 'least some third world kid is bouta get a new pair
6384,more-homework-mintchev,wHAT BAND IS THAT? SKILLEKS?
6385,self-important-anarchist,"""the intellectuals co"
6386,self-important-anarchist,i hate the patriarchal family especially my mom
6387,self-important-anarchist,thinks short
6388,self-important-anarchist,think leadership is bad tells people what to do
6389,self-important-anarchist,"we all have intersecting oppressions i'm where ""childless bachelor"" intersects with ""private school trust"
6390,uniporpoisus,i fart  skittles
6391,uniporpoisus,if seen u r high
6392,uniporpoisus,Nope TOTALLY STRAIGHT why?
6393,uniporpoisus,high! you see me
6394,uniporpoisus,totally straight  why do u ask?
6395,the-giving-oprah,EGGS AND BACON FOR EVERYONE
6396,the-giving-oprah,grenades for everybodyyyyyyyyyyyyyy !!!!!!!!!!!!!!!
6397,the-giving-oprah,You get a vote! and you get a vote! Everybody gets a vote!
6398,the-giving-oprah,"YOU'VE GOT DOWNS, YOU'VE GOT  DOWNS  eVERYBODY HAS DOWNS!!!"
6399,the-giving-oprah,YOU GET SOME LOVE! YOU TOO! SO DO YOU! EVERYBODY GETS SOME LOVE!
6400,long-island-mom,sarry
6401,long-island-mom,when i was your age i walked from seaford to copaige every day.
6402,long-island-mom,central islip? ya wanna get killed?
6403,long-island-mom,Have you guys been drinking
6404,long-island-mom,You are my sunshine my only sunshine
6405,eating-disorder-owl,orders a diet coke don't drink it because you think they're lying to you
6406,eating-disorder-owl,Relates to ED OWL AND LAUGHS Can't share it with others
6407,eating-disorder-owl,knows everything about nutrition and healthy eating applies none of it to own life
6408,eating-disorder-owl,TherE's a stomach bug going around? I hope I catch it
6409,eating-disorder-owl,"""You're too fat to have an eating disorder!"" ""...oh. Oh, yes, that's helping."""
6410,balotelli,reaches final 4
6411,balotelli,They See Me Scoring They Hatin
6412,balotelli,6
6413,balotelli,completely worthless. not even italian.
6414,balotelli,Goes to strip club 12 hours before next match plays
6415,danish-problems-roligan,50 is 2 and a half times 20
6416,danish-problems-roligan,agreeing with swedishproblems
6417,danish-problems-roligan,"""the ice is smelting in the poles"""
6418,danish-problems-roligan,posting useless shit on 1.C damn you noob!
6419,danish-problems-roligan,yes! he's going to score! Fuck you torres!
6420,animexs3,anime is not for  LOSERS!!!
6421,animexs3,ye you like anime yesssss!!!!!
6422,animexs3,3 reasons anime is cool 1. its anime 2. it's anime 3. It's anime
6423,animexs3,Male friends are yelling at each other. Yells at them to suck each others dicks.
6424,animexs3,you wake up in the last manga you read How Screwed are you
6425,live-it-up,taking out the trash... at night!!!
6426,live-it-up,Career`s memes
6427,live-it-up,"What do I stand for? What do I stand for? Most nights, I don't know anymore..."
6428,live-it-up,The library at break!!
6429,live-it-up,WE CAREERS GOT THE WORLD  AHEAD OF US! EXCEPT WE DIED...
6430,instant-flame-war,Instant flame war just add turtles
6431,instant-flame-war,Instant flame war just add a picture of muhammad
6432,instant-flame-war,Instant flame war just add TRUKK NOT MUNKY
6433,instant-flame-war,Instant flame war just add flamers
6434,instant-flame-war,Instant flame war just add Twilight
6435,shelley-bo-delly,some days just arent worth putting on a bra
6436,shelley-bo-delly,i never met a veteran who fought for socialism
6437,shelley-bo-delly,im sorry i hurt your feelings when i called you stupid i thought you already knew
6438,shelley-bo-delly,its not a hangover its wine flu
6439,shelley-bo-delly,if i ever go missing put my face on a wine bottle not a milk carton so my friends can find me
6440,friendly-creepy-guy,wanna play rape? no? that's the spirit!
6441,friendly-creepy-guy,My sister is pretty hot
6442,friendly-creepy-guy,you kids wanna do a little bitta campin or what?
6443,friendly-creepy-guy,"I don't always sneak up on people Lol Jk, Suprise buttsex"
6444,friendly-creepy-guy,Come here i moustache you something
6445,typical-chisinau,АЙ ЦЫГЭРЬ БЭЙ? БЛАГОДАРЮ!
6446,typical-chisinau,"Buna seara, politia municipala Fumati shmali nahui aishea?"
6447,typical-chisinau,
6448,typical-chisinau,bai ia tibe adin na adnaklasniki pastavliu
6449,typical-chisinau,wai si fata frumoasa... bai pidaraska auzi pe mine?
6450,niceguybriang,i wont rape you unless i date you
6451,niceguybriang,"If you get married, you agree to sex it saddens me that this is no longer obvious"
6452,niceguybriang,No means No! Unless you're dating
6453,niceguybriang,"If a woman is unhappy in a relationship, she should leave if she doesn't she should accept the consequences"
6454,niceguybriang,i do not rape girls but only because it's against the law
6455,advice-furry,THEY LAUGHED AT MY FURSUIT I WORE IT AT THEIR FUNERALS
6456,advice-furry,Talk to the  paw!
6457,advice-furry,furry hatter tells you to yiff in hell take their soul with you
6458,advice-furry,"You pissed in my ass! God damn it, Insanity Wolf."
6459,advice-furry,TELL ME YOUR PROBLEMS ALL OF THEM
6460,beauty-addict-kitty,Boyfriend asks you to stop going to sephora How about he stops being your boyfriend
6461,beauty-addict-kitty,Yo mama's so white she's an NC15
6462,beauty-addict-kitty,husband says you have enough make up no sex for a week
6463,beauty-addict-kitty,cAN'T NAP MAKEUP WILL SMUDGE
6464,beauty-addict-kitty,"Friend asks if you really need to buy more nail polish Just kidding, They aren't your friend."
6465,high-expectations-asian-student,4.99 gpa aCADEMIC sUICIDE
6466,high-expectations-asian-student,gets B
6467,high-expectations-asian-student,has one night stand not enough room for books
6468,high-expectations-asian-student,Once you go asian you never miss an equation
6469,high-expectations-asian-student,asian not in mathcounts?  ha ha ha good joke
6470,homer-advice,"""This is the Worst day of my life"" Worst day of your life *so far*!"
6471,homer-advice,Operator give me the number to 911
6472,homer-advice,the Eight words that save you it was like this when i got here
6473,homer-advice,IT'S MY FIRST DAY!
6474,homer-advice,"If something goes wrong, blame the guy who can't speak English."
6475,gentleman,Beating the wife Like a sir
6476,gentleman,Partying hard like a sir
6477,gentleman,"i will call you Mylady, mrs and miss Ponce While doing nasty things to your naked body"
6478,gentleman,You have exquisite musical taste. We should engage in coitus.
6479,gentleman,searching meme like a sir..
6480,anakindarthvader3revengeofthesith,"IPK 3,20 ? YOU UNDERESTIMATE My power"
6481,anakindarthvader3revengeofthesith,U think zero will stop me you underestimate my power
6482,anakindarthvader3revengeofthesith,YOU UNDERESTIMATE My power
6483,anakindarthvader3revengeofthesith,You underestimate my social awkwardness
6484,anakindarthvader3revengeofthesith,i might not get the job? you underestimate my power
6485,super-veterano-da-praxe,Não tem argumentos tá tudo de 4
6486,super-veterano-da-praxe,"""Tá tudo de quatro!"""
6487,super-veterano-da-praxe,Dvra praxis sed praxis ninguem me rapa
6488,super-veterano-da-praxe,Quem manda aqui sou eu Vai beber um fino mal aparece o dvx
6489,super-veterano-da-praxe,o meu ano é que foi praxe dura não consegue fazer 10 flexões seguidas
6490,trunner,набрал форму получил травму
6491,trunner,после халявнойтренировки иду домой пешком
6492,trunner,
6493,trunner,WTF Wild training freaks!
6494,trunner,This is the run!
6495,strange-gay,The moment u realize Spongebob has a dick on his face
6496,strange-gay,claims BISEXUALITY isn't real tells EVERYONE he's sleeping with a straight dude
6497,strange-gay,CHRIS Y U SO GAY?
6498,strange-gay,wIDE_OPEN_rOAD JUST CAN'T HELP LOOKING GAY
6499,strange-gay,"wIDE_OPEN_rOAD YES, ITS REALLY HIM"
6500,beloruskijomon,ill never watch transformers
6501,beloruskijomon,
6502,beloruskijomon,if kieran and tom had a baby it would be him
6503,beloruskijomon,if kieran and tom had a baby chevron ed(2)
6504,beloruskijomon,F8Dq7 aSLH4
6505,dj-advice-paris,140bpm & 70BPM WON'T MIX THEY'RE COMPLETELY DIFFERENT NUMBERS
6506,dj-advice-paris,I can suck cock As good as i suck in dj'ing
6507,dj-advice-paris,Afrojack Now your just somebody that I used to blow...
6508,dj-advice-paris,Tolgar can put this many fingers in me
6509,dj-advice-paris,You only have two options when in front of a knob Twist it or suck it
6510,fast-food-feline,customer Orders a double down sandwich and a diet dr pepper no judgement
6511,fast-food-feline,Customer pulls money out of bra ew
6512,fast-food-feline,Someone is nice give them all the things
6513,fast-food-feline,"""Can I get a double"
6514,fast-food-feline,See customers walking across the street toward shop Don't you dare come in here!!
6515,spock,Leonard Nimoy Lived long and prospered
6516,spock,spock  vulcan shocker
6517,spock,"so, to cure ebola we bring the diseased to America fascinating...."
6518,spock,Live long and prosper You will be missed Spock!
6519,spock,I tell people that this means live long and prosper but this is actually how you flip someone off on planet vulcan
6520,ermagerd-stools,FenImi... FemNin... Femeniniminninim!!
6521,ermagerd-stools,ermagerd spermmm
6522,ermagerd-stools,ermagerd werped terr
