,IMG_PATH,MEME_CAPTION
3076,roller-derby-otter,tRY ON pants fit everywhere but thighs
3077,roller-derby-otter,skip a week of practice suddenly worst skater on the league
3078,roller-derby-otter,VOmiting? You can finish the drill when you're Done
3079,roller-derby-otter,buy awesome socks someone else already has them
3080,freedom-eagle,i shit on america literally i do. i fly around and shit all over the place.
3081,freedom-eagle,Oil in Morocco? sounds like they need some freedom
3082,freedom-eagle,THEY'VE GOT GAS AND OIL? SOUNDS LIKE SCOTLAND COULD USE… SOME FREEDOM
3083,freedom-eagle,don't worry ukraine democracy is coming
3084,freedom-eagle,Scotland has oil? Looks like they could use some freedom
3085,linguistics-ape,"Hungarians want to know where at, on, under, between.. such a superessive society."
3086,linguistics-ape,new baby sister? my conlang shall have a native speaker
3087,linguistics-ape,"Anth prof stumbles through explanation of linguistics someone please remind me, why i am here???"
3088,linguistics-ape,dine at ethnic restaurant know how everything is pronounced
3089,linguistics-ape,Film Dubbung The eighth sin
3090,right-in-the-childhood-man,Almost every young Disney and Nickelodeon actress Grew up to be a whore
3091,right-in-the-childhood-man,bet on alabama crimson tide  will be living in a van down by the river tomorrow
3092,right-in-the-childhood-man,Right in the Ocd
3093,right-in-the-childhood-man,What happened to nickelodeon? It's like it turned into another disney channel
3094,right-in-the-childhood-man,millennials make baby boomers cringe
3095,whose-line,Welcome to America Where the News is made up and the points don't matter
3096,whose-line,Welcome to Game of thrones where every main character you love will die
3097,whose-line,Welcome to America Where the happiness is all made up and whoever dies with the most debt wins
3098,whose-line,Welcome to quantum where the rules seem made up and regular physics doesn't matter
3099,whose-line,Welcome to the usa where the constitution no longer applies
3100,charlie-sheen-winning,i don't know if u know this but.. i'm winning.
3101,charlie-sheen-winning,sloppy sixteenths winning
3102,charlie-sheen-winning,how much cocaine did i snort? Enought to kill two and a half men.
3103,charlie-sheen-winning,THAT'S MY SON
3104,charlie-sheen-winning,"A fired, abusive,AIDS ridden drug addict. winner!"
3105,high-standards-history-teacher,no one did the reading? supply and demand curve
3106,high-standards-history-teacher,"essay is generally good, but has some problems Final Grade: C"
3107,high-standards-history-teacher,Not tilapia osama
3108,high-standards-history-teacher,Comical mannerisms? nooo...
3109,high-standards-history-teacher,no one did the reading?
3110,baby-france,remember when... france used to have people who looked like this ?
3111,baby-france,JUST SAY IT YOU THINK I'M ADORABLE
3112,baby-france,little arzzhur is a bunny
3113,baby-france,discovers tv thinks it'S A BOX WHICH EATS LITTLE CHILDREN'S SOULS
3114,baby-france,talk about arzzhur all day long not my boyfriend
3115,roleplay-panther,i cast magic missile! ...at the darkness
3116,roleplay-panther,"Create new character make sure theres doom, evil, or slayer in the name somewhere"
3117,roleplay-panther,"""I play realistically"" Mods guns into Skyrim"
3118,roleplay-panther,become admin make rocket events that kill everyone
3119,roleplay-panther,make new character enclave killed family
3120,morfeo,What if i told you  your students have other classes
3121,morfeo,What if I told you That you're watching me?
3122,morfeo,What if i told you that you can jungle in 3v3
3123,morfeo,מה אם אני אגיד לך שינאי לא שלח היום מייל
3124,morfeo,"NEO, PILLOLA ROSSA = RADUNO ""STYLE TUNING""  PILLOLA BLU = MARE  COSA SCEGLI?"
3125,er-mah-gerd,Er mah gerd california!
3126,er-mah-gerd,HErgs bergsssss
3127,er-mah-gerd,er mah gerd herpy berthder pete er
3128,er-mah-gerd,Er ah gerd mikey mouse goatze
3129,er-mah-gerd,ER MAH GERD DEE DEE DEE
3130,down-syndrome-drake,I made a doodie
3131,down-syndrome-drake,Its ok guys drake just tired himself out from rapping Poor little guy. Ya know we let him dress himself this morning
3132,down-syndrome-drake,last name greatest ever first name potato
3133,down-syndrome-drake,I can count to  Potato
3134,down-syndrome-drake,I can do math Square root of 69 is potato
3135,socially-terrifying-penguin,Burglar enters house through a window leaves in a body bag
3136,socially-terrifying-penguin,Cop pulls you over let him off with a warning
3137,socially-terrifying-penguin,GF INTRODUCES HER MOM EXPECT THREESOME
3138,socially-terrifying-penguin,Takes picture of self at ground zero smiles
3139,socially-terrifying-penguin,Has a nightmare Kills the monster
3140,hell-hound,THERE IS A REASON I'M IN THE FAIL TIER IF I WERE PUT IN THE GOD TIER I WOULD QUICKLY RISE TO POWER
3141,hell-hound,bafo  poderoso do ramos!
3142,hell-hound,gvhg fgjgj
3143,hell-hound,insanity wolf? =lunch
3144,hell-hound,growl my face n howl! scrunch my face n cohl!
3145,cunningputin,Think I shouldnt invade ukraine? crimea river
3146,cunningputin,Obama thinks I shouldn't invade ukraine ? Crimea  River !
3147,cunningputin,crimea does pay
3148,cunningputin,checkmate
3149,cunningputin,in soviet russia the fool pities mr. t
3150,scumbag-analytic-philosopher,Uses the pronoun 'she' for all his examples Doesn't ever cite any actual women
3151,scumbag-analytic-philosopher,Theorizes about quantum physics Can't solve a second degree equation
3152,scumbag-analytic-philosopher,thinks you're silly for accepting existence of god Accepts modal realism
3153,scumbag-analytic-philosopher,gives a priori argument for empiricism
3154,scumbag-analytic-philosopher,Claims to be a hedonistic act Utilitarian Still has two kidneys
3155,denial-mark,I want everybody to get a good education takes away the basic student financing
3156,denial-mark,Sander's taste in good music DOES NOT EXIST!
3157,denial-mark,IF I WOULD AGREE... WE WOULD BOTH BE WRONG...
3158,denial-mark,Doe is normaal man wat ach
3159,denial-mark,poverty DOES NOT EXIST IT DOES Not exist
3160,smmspecialist,how much horse shit can i fill facebook with?
3161,smmspecialist,I'm being productive...Quick... Waste time on facebook!
3162,smmspecialist,ITS ALL WHAT I M N IDO
3163,smmspecialist,DOGGY STYLE and facebook getting f**ked from behind
3164,smmspecialist,NO!! SC
3165,swagrias,Im incredibly drawn Ur not.  Case closed
3166,swagrias,"Is called a ""holy knight"" Kills god"
3167,swagrias,Goes to save princess ovelia saves the entire party as well
3168,swagrias,let's touch hands 'tis not a question
3169,swagrias,let us do it and i shalt leave mine armor on
3170,facebook-roleplay-ocelot,find out rp'er is really a fake kill kill destroy burn report!!!!
3171,facebook-roleplay-ocelot,whut people do fandom rp?... with..with *RULES*!?!?
3172,facebook-roleplay-ocelot,"rp sex with someone, they use a phrase someone else uses during sex i know you cheated."
3173,facebook-roleplay-ocelot,your character is completely in love with another character and you are feeling it but it's not cheating why are you getting so jealous omg
3174,facebook-roleplay-ocelot,in ooc relationship with rp partner hopefully these actions are translated as what I'm gonna do to you some day
3175,frustrated-journalist-cat,unfortunately nelson mandela has passed but on the bright side that means the paul walker posts will stop
3176,frustrated-journalist-cat,Transcribing STory Can't read my own handwriting
3177,frustrated-journalist-cat,could you be sure to mention our sponsors in the story? no.
3178,frustrated-journalist-cat,reader sends letter to editor complaining about your story so full of typos that it takes three reads to realize it's an insult
3179,frustrated-journalist-cat,you're asking to remain anonymous in a story with no controversy ...really?!
3180,socially-inept-moose,MOOSEN I SAW A FLOCK OF MOOSEN
3181,socially-inept-moose,puts petrol in car cries that it cost £35
3182,socially-inept-moose,broke promise after 3 minutes
3183,socially-inept-moose,Human Centipede? I'll be the middle
3184,socially-inept-moose,enough of the moose memes!!!
3185,aand-its-gone,GOT WI
3186,aand-its-gone,Oh look summer Aaaand it's gone
3187,aand-its-gone,Yay it's the weekend aaaaand it's gone
3188,aand-its-gone,mitt romney is currently in the lead ....aaaand its gone
3189,aand-its-gone,had faith in obama aaaaand it's gone
3190,ali-g,Is it cos I is black?
3191,ali-g,BIG UPS TO MY mAIN mAN gREER
3192,ali-g,new hip hop sensation mr. yo thug
3193,ali-g,Big up yourself
3194,ali-g,F**king plants and sh*t booyakasha
3195,the-judes,blowing up your wall with my rap skillz bitches
3196,the-judes,judeslaw007 going to law school bitches
3197,the-judes,"""life is like a box of chocloates"" chinese proverb"
3198,the-judes,Michael kors n shit that's TIGHT.
3199,the-judes,Michael korS n shit thats tight.
3200,oso-hormiguero-thug,embrace the change
3201,oso-hormiguero-thug,vengan pa aca poh culiao
3202,oso-hormiguero-thug,come at me bro
3203,oso-hormiguero-thug,Eight
3204,oso-hormiguero-thug,i didn't choose thuglife thug life choose me
3205,glitter-moose,nice rack glitter moose
3206,glitter-moose,glitter moose national animal of glitter canada
3207,glitter-moose,Glitter Moose Don't care
3208,glitter-moose,GLITTER MOOSE Reindeer wouldn't call him names
3209,glitter-moose,glitter moose ...or vampire moose?
3210,typical-israelite,"My left arm is called ""west bank"" my right arm is called ""gaza!"
3211,typical-israelite,gay yid
3212,typical-israelite,this isn't an israelite. just another semitic piece of shit.
3213,typical-israelite,eww brad regier Karen's first bastard! 4624 NE 12 the street newton ks! too bad your like
3214,typical-israelite,Is defending himself  by invading a coutntry
3215,protein-in-deficient-guy,Deficient Guy
3216,protein-in-deficient-guy,Deficient Guy
3217,protein-in-deficient-guy,Deficient Guy
3218,protein-in-deficient-guy,Deficient Guy
3219,protein-in-deficient-guy,Deficient Guy
3220,astute-psychologist,ЗАКОНЧИЛ ПСИХФАК
3221,astute-psychologist,
3222,astute-psychologist,сниженный фон настроения можно повысить!
3223,astute-psychologist,"psychologist. ""Everything you say can and will be used Against you"
3224,astute-psychologist,M E M E  M I N D   C O N T R O L
3225,florian-telwin,I'm the just the way god made me ...the liberator of all mankind
3226,florian-telwin,Meep Beep
3227,florian-telwin,When I walk in the spot this what I see Jazmyn Davis is looking at me!xD
3228,florian-telwin,put my face as a meme no one liked it
3229,florian-telwin,fhvb
3230,cultural-joke,Admits she doesn't now anything about culture becomes minister of culture
3231,cultural-joke,I love live shows I watch 'the voice' everytime
3232,cultural-joke,van gogh cut off his ear lets ban impressionism
3233,cultural-joke,DoeSN't GO TO LIVe CONCERTS RUINS IT FOR EVERYONE
3234,cultural-joke,never had fun during my youth neither will you
3235,spiderman-sick,YOur stupid and pointless memes Gave me cancer
3236,spiderman-sick,CARS 2 GAVE ME CANCER
3237,spiderman-sick,DON'T SHARE NEEDLES
3238,spiderman-sick,Time to Climb out the Window... I don't have health insurance
3239,spiderman-sick,This shit gave me ebola
3240,sherlock-h,No Shit sherlock
3241,sherlock-h,WAtch csi solve before yeaaaaah
3242,sherlock-h,THINK It's the new sexy
3243,sherlock-h,Flatmate calls you an idiot ask him out to dinner
3244,sherlock-h,"You see, but you do not observe"
3245,bastard-market-researcher,Vote +5 on me right fucking now!
3246,bastard-market-researcher,Vote
3247,bastard-market-researcher,"If you wanna take the bike out, I'm gonna have to charge you a penalty ""What kind of bastard relies on offers with ridiculous conditions as one of his main tactics?"""
3248,bastard-market-researcher,Even kids know my offers come with ridiculous conditions
3249,bastard-market-researcher,Children...  This memer is currently in violation of OVER NINE THOUSAAAAAAAAAAAAAAAAND of your mother's rules.
3250,gayy-unicorn,Happy Birthday  Josh!
3251,gayy-unicorn,we found love in a hopeless place aka the bathroom stall of the gay club
3252,gayy-unicorn,you smell like  craigslist
3253,gayy-unicorn,L
3254,gayy-unicorn,Kelli Touch my rainbow.
3255,eat-the-cockroach,i dont always fly but when i do run
3256,eat-the-cockroach,Flushed down the toilet Worked my way back up
3257,eat-the-cockroach,"I don't always eat people food but when I do, it's on your plate"
3258,eat-the-cockroach,He will be laughing when when we die of nuclear war
3259,eat-the-cockroach,"It's cool, bro I'll get the crumbs"
3260,love-game-greg,"she watches doctor who ""ooh so do I"""
3261,love-game-greg,she replies after being away you. didn't. notice
3262,love-game-greg,i won't text first its your turn
3263,love-game-greg,She Texts First Your winning
3264,love-game-greg,ignore her when she doesn't text back right away she will feel guilt
3265,ryan-gosling-hey-girl-3,"Hey girl, The way you study all the time and don't go out is really sexy."
3266,ryan-gosling-hey-girl-3,hey girl i hear you learned about plasma cells today i hope you are the antigen my antibody is waiting for
3267,ryan-gosling-hey-girl-3,Hey girl you should be studying
3268,ryan-gosling-hey-girl-3,"Hey Girl, I'd love get on a stable exchange stage with you and go from a ""me"" to a ""we""."
3269,ryan-gosling-hey-girl-3,"hegel I Goethe have you, because i nietzche so bad."
3270,feministka,"""objectifying women is wrong!"" takes a selfie in her underwear every day trying to make the dar"
3271,feministka,supports female independance... asks dad for money.
3272,feministka,Gets caught lying about being raped still pretends to be the victim
3273,feministka,"you're Not a feminist, but... well, i'm a feminist"
3274,feministka,"traveled to 7 different cities to watch 7 different artists perform ""the vagina monologues"" still cannot grasp the ironic disconnect inherent in using the word ""douchebag"" as an insult."
3275,typical-ballroom-dancer,"ЛИЧНАЯ ЖИЗНЬ? НЕ, НЕ СЛЫШАЛА"
3276,typical-ballroom-dancer,everyday you're shufflin
3277,typical-ballroom-dancer,Which dance will a chicken not do ? The foxtrot !
3278,typical-ballroom-dancer,dón't ündêrständ whát thèÿ ãré wrïtìng
3279,typical-ballroom-dancer,будильник на 4 утра первый тур в 9!
3280,bizzychu,learns all attacks can mimic any voice
3281,bizzychu,i dont always use penis but when i do it hardens
3282,bizzychu,HI i'm batman and i have a pokemon called penis
3283,bizzychu,TRIES TO MAKE A MEME CAN ONLY IMITATE A MEME'S VOICE
3284,bizzychu,Girls:stop duckface Make PikaFace
3285,no-this-is-patrick,"is this isis headquarters? No, this is patrick!!!"
3286,no-this-is-patrick,Is this reality!? No This Is patrick!!!
3287,no-this-is-patrick,Is this the Krusty Krab? No! bite my shinny metal
3288,no-this-is-patrick,"is this madness? no, this is sparta!"
3289,no-this-is-patrick,hello is this patrick no its isis
3290,james-hetfalse,ok guess what metallica
3291,james-hetfalse,Just give me that riff there along with fries and 2 cheeseburgers
3292,james-hetfalse,the Beatles? never heard of are they opening for metallica?
3293,james-hetfalse,LE GANAMOS 1
3294,james-hetfalse,master of puppets can i be barbie?
3295,superami-crazy,"i Watch supernatural all day,all night"
3296,superami-crazy,кошка смотрит в одну точку это не к добру
3297,superami-crazy,смотрю ток
3298,superami-crazy,asks why its dark outside told its a dome of ninjas
3299,superami-crazy,паблик моей мечты!
3300,rebecca-black,walks to the bus stop to get in a car
3301,rebecca-black,11/11/11 11:11:11 Friday friday friday
3302,rebecca-black,which seat? the trunk
3303,rebecca-black,If my name was Rebecca white... YOU WOULD'VE LOVED IT.
3304,rebecca-black,Today is my day black friday
3305,typical-cop,cop
3306,typical-cop,cop
3307,typical-cop,cop
3308,typical-cop,cop
3309,typical-cop,cop
3310,lovely-derpy-rp-unicorn,A supermodel can get 10000 likes lets see how many for this druggie unicorn
3311,lovely-derpy-rp-unicorn,Cloud The Perfect Place for My Data
3312,lovely-derpy-rp-unicorn,This is the definition of the internet
3313,lovely-derpy-rp-unicorn,im not crazy  my reality is just different than yours
3314,lovely-derpy-rp-unicorn,HEY THERE! I LOVE YOU))
3315,tony-kozina,Give me dem boys
3316,tony-kozina,GIVE ME YOUR YOUNG BUCKS
3317,tony-kozina,dropped the soap #yolo
3318,tony-kozina,I'M A BULLDOG THROUGH AN THROUGH I'M A BULL... FARK HOW YOU SPELL BULLDOG AGAIN ?
3319,tony-kozina,GIVE ME YOUR 20 year olds
3320,rebellious-fluttershy,Scared of EVERFrEE Forest LIVE NEXT TO IT
3321,rebellious-fluttershy,Loves everything kills a bear in season 2
3322,rebellious-fluttershy,I WENT DOWN to THE MEME GENERATOR AND I WAS LIKE.. ʸᵃʸ﻿
3323,rebellious-fluttershy,Cool Story Bro. Tell It Again.
3324,rebellious-fluttershy,you must be new here would you like me to show you around?
3325,mckayla-maroney-does-not-approve,"5,000 facebook friends? Not impressed"
3326,mckayla-maroney-does-not-approve,"Bro, Do You even tumble?"
3327,mckayla-maroney-does-not-approve,cramps? .....not....impressed
3328,mckayla-maroney-does-not-approve,God McKayla Maroney does not approve
3329,mckayla-maroney-does-not-approve,Got a scholarship? Mckayla does not approve
3330,laura-chinchilla,IPHONE BATTERY AT 2% GETS A NEW ONE
3331,laura-chinchilla,friend is sick writes an obituary
3332,laura-chinchilla,scores a goal ends the game
3333,laura-chinchilla,"PARA LOS SIGUIENTES AÑOS GOBERNARE INTEGRA, FIRME Y HONESTA FELIZ DÍA DE LOS INOCENTES!"
3334,laura-chinchilla,baby is hungry gives him up for adoption
3335,medik,правило 15 мин нет препода
3336,medik,поступил в мед
3337,medik,"начнем пораньше, закончим попозже зато без перерыва!"
3338,medik,TAGILUS INFERIOR!!!
3339,medik,мне попался пациент явно чумачечий только скальпель достаю
3340,sauna-girls,"he is different yes,but why you give your pussy to the other guy"
3341,sauna-girls,One chance in life for a three way and you couldn't get it up
3342,sauna-girls,MAG IK JE KUT ZIEN? JA HOOR ALS IK JE PIEMEL MAG ZIEN!
3343,sauna-girls,while you generate memes your girlfriend is telling her secret lesbian lover about how your dick goes limp
3344,sauna-girls,SEX SEX
3345,english-class-nicole,not sure if I just walked into english class or one of my horcruxes was destroyed
3346,english-class-nicole,go back to the maine or whatever
3347,english-class-nicole,I'll just study it during the test
3348,english-class-nicole,"My balogna has a first name, it's ben."
3349,english-class-nicole,"Sees a series of random numbers and letters on the board uggh,,,,another journal"
3350,hypocrite-gordon,Claims to be opinionated Just reposts shit from Reddit
3351,hypocrite-gordon,memes dead still thinks people care
3352,hypocrite-gordon,"Hates christians, love's guy fawkes doesn't know guy fawkes was radical catholic"
3353,hypocrite-gordon,PROTESTS AGAINST BIG CORPORATIONS USES FACEBOOK
3354,hypocrite-gordon,"""You can BELIEVE anything you want"" ""lol you BELIEVE in god?"""
3355,highly-cultured-lady,Ik ben lazar  en ik draag rode bont
3356,highly-cultured-lady,u r missing a number in this test  Really let me check 1234 ohhhhh
3357,highly-cultured-lady,SUMI MISS TO A STUDENT: TMRE AMI PHYSICS SHIKHAI CHARBHO!!
3358,highly-cultured-lady,"I have the impression that this informal rule ""Ladies first"" has been invented by men ,  so they can have the time to look at our ass .."
3359,highly-cultured-lady,"Tu Madre is so classy that she did all the ornate scroll carving around the local glory hole by hand, complete with a beeswax/linseed oil finish."
3360,games-workshop-guy,Collecting Tyranids? You definately need a stormraven then!
3361,games-workshop-guy,You know what goes well with those Vampire Counts? A white Dwarf Subscription
3362,games-workshop-guy,You can't play other companies games here go play that necromunda somewhere else
3363,games-workshop-guy,Best Miniatures in the World Releases Finecast
3364,games-workshop-guy,Sells you Space Hulk Forbids you to talk about it in store
3365,annoying-orange,this is your food. when you are on lsd
3366,annoying-orange,Hsienju have you taken ur vitamin C?
3367,annoying-orange,I'M NOT ANNOYING I'M AN ORANGE
3368,annoying-orange,"Hey! HeY, apple! OraNge yoU glad thAt i didn’t say apple agaIn?"
3369,annoying-orange,"JIngle bElls, BatmAn smells i jusT Crapped My NonExistenT pAnts!"
3370,rattos-locos-boz,warum verschwendest du deine zeit mit rap? okay ich mach es auch
3371,rattos-locos-boz,tu nich so als wärst du was besonderes Wie n laptop
3372,rattos-locos-boz,dein label ist nicht korrekt sondern dubios
3373,rattos-locos-boz,Deine Panik Ist eine Schlampe
3374,rattos-locos-boz,"Salam aleikum, alle mal reinkomm Freibier"
3375,nhkanimexs,i'l watch only one episode of anime said no one ever
3376,nhkanimexs,DALE LAIK SI ERES OTAKU
3377,nhkanimexs,"Konata She can't stop saying ""Good job!"" to everything"
3378,nhkanimexs,i just created this meme thing omg
3379,nhkanimexs,buttseks!
3380,tolyatti,где купил найки в just shop
3381,tolyatti,
3382,tolyatti,
3383,tolyatti,radiation for everyone
3384,tolyatti,"бесит город, в котором живешь ты в Тольятти, детка"
3385,guffdead,без труда  не вытащишь и гуфа из гроба
3386,guffdead,Guf r.i.p. Did he drop any good loot?
3387,guffdead,медленно летим
3388,guffdead,Санёк это как саша только александр
3389,guffdead,guf r.i.p. мой ник поэтому меня убивают  в css
3390,forever-bronze,ASKS FOR ADVICE DOESNT USE IT
3391,forever-bronze,YES! First time scout 2 player map
3392,forever-bronze,get into bronze top 8 no one to share with
3393,forever-bronze,get placed into bronze league goes and plays lol
3394,forever-bronze,Post on SC forums gets pointed on being bronze...
3395,huerta-stalker,rectum? Absolutely.
3396,huerta-stalker,Will you sign MY COMMUNITY HOURS SHEET?
3397,huerta-stalker,Roger has gf? i'll huerta
3398,huerta-stalker,still a better    love story than twilight
3399,huerta-stalker,"On The other hand... Who am I kidding, I only need one hand"
3400,casey-anthony-burn-in-hell,STILL GUILTY
3401,casey-anthony-burn-in-hell,KILL IT WITH FIRE
3402,casey-anthony-burn-in-hell,STILL GUILTY
3403,casey-anthony-burn-in-hell,STILL GUILTY
3404,casey-anthony-burn-in-hell,STILL GUILTY
3405,the-non-molesting-priest,Molesting Priest
3406,the-non-molesting-priest,Molesting Priest
3407,the-non-molesting-priest,Molesting Priest
3408,the-non-molesting-priest,Molesting Priest
3409,the-non-molesting-priest,Molesting Priest
3410,akunneuvo,Teppo tulppu kusipää homo
3411,akunneuvo,are you wanna die
3412,akunneuvo,Saa potkut töistä ryyppää sihi juomaa
3413,akunneuvo,sihi juoma VEDÄ KÄNNIT
3414,akunneuvo,Maratooni 42km juokse 3000km timbuktuun
3415,call-of-duty-addict,".50 caliber to the chest, only a little hurt knife to the toe, dies instantly"
3416,call-of-duty-addict,pay $60 to t
3417,call-of-duty-addict,"""We need more call of duty games!"" said no one ever"
3418,call-of-duty-addict,HANOI LEAVE GAME
3419,call-of-duty-addict,REALLY? I'M PRETTY SURE I SHOT FIRST
3420,lara-croft,tu     .  .  . e il tuo maledetto dito a banana
3421,lara-croft,aspetta... devo trovare l'ultimo segreto
3422,lara-croft,"I'm a dangerous girl And right now, i'm losing patience"
3423,lara-croft,goditi la vita puoi sempre ricaricare
3424,lara-croft,Draw me like one of your french girls
3425,peace-bus,Pays rent still under the bus
3426,peace-bus,pays rent keeps house safe watches over yet still gets thrown under
3427,peace-bus,take the leighson to the bus stop don't stop till he's on a bus
3428,peace-bus,aaron and asa..... peace<3
3429,peace-bus,He sees me rollin' He hatin'
3430,extrasense,what do I see!!! tacos and beer
3431,extrasense,U are Next !!!
3432,extrasense,oh herr kevin ihre zukunft? afk sein!
3433,extrasense,Closing at 400pm
3434,extrasense,Tin Team swami wegetting violated
3435,noizemc,I LOVE NOIZE MC
3436,noizemc,Bro! STFU about your babymama! You Fucked her !!!
3437,noizemc,SO YOU THINK  YOU CAN DANCE
3438,noizemc,#LETSSTARTTHEPARTY
3439,noizemc,я выбираю Noize mc
3440,idiot-vanilla-girl,buys $900 Ipad to play same game she played on her iphone
3441,idiot-vanilla-girl,"Ya I Hack. ""Shell?"""
3442,idiot-vanilla-girl,Sono un'esperta di computer tira fuori il MacBook con core 2 Duo
3443,idiot-vanilla-girl,chemtrails? no thank you i do not do cocaine
3444,idiot-vanilla-girl,vanilla bitch
3445,shitty-infancy-quan-chi,"If Shinnok were here, he would have tried to talk things out first. Unfortunately for you, Shinnok isn't here."
3446,shitty-infancy-quan-chi,I shall continue meming with this template to keep it from going under
3447,shitty-infancy-quan-chi,""""
3448,shitty-infancy-quan-chi,Vote at least +5 or you will serve me in the Netherrealm by dealing with my infantile psychological trauma!
3449,shitty-infancy-quan-chi,"Alas, poor Yorick... I filed a restraining order against him, for he kept falling on my head and damaging my brain."
3450,keep-calm-and,LET THIS MEME DIE
3451,keep-calm-and,LOOK IT UP ON GOOGLE
3452,keep-calm-and,make shitty memes
3453,keep-calm-and,actually do something with your life
3454,keep-calm-and,keep calm
3455,excessively-trying-girl,what ıf i go on a dıet?
3456,excessively-trying-girl,OMFGWTFPNEDBYNAVIGATE
3457,excessively-trying-girl,OMFGWTFPNED BY NAVIGATE
3458,excessively-trying-girl,Gostas de comer porcas quintas feiras na praxis tas no curso de desporto
3459,excessively-trying-girl,EvERYONE JUST JOIN IT'S A REALLY GOOD CAUSE
