,IMG_PATH,MEME_CAPTION
0,brainless-dumbass,miss Aggio won't marry me allow
1,brainless-dumbass,Tells Joke laughs at joke when nobody else does
2,brainless-dumbass,buys viking game never plays it
3,brainless-dumbass,I like english coz i am the goodest at it
4,brainless-dumbass,Someone said vagina LOl!!!
5,y-u-no,meme generator users y u no give me more upvotes?
6,y-u-no,steve jobs y u no respawn?!
7,y-u-no,commercial y u no same volume as show!?
8,y-u-no,KONY Y u no take justin bieber
9,y-u-no,TED y u no tell us how you met their mother
10,successful-black-man,i got 99 problems correct out of 100
11,successful-black-man,i love beating women to the door so i can open it for them
12,successful-black-man,Your Girlfriend Blew Me Away with her highly effective motivational seminar
13,successful-black-man,"lets go rob we're going to be late for the company meeting, buddy"
14,successful-black-man,Just Got Out of Jail By Rolling doubles
15,bootlace,what? no tension wrench?
16,bootlace,the farley mount fucking wanker
17,bootlace,when can i fuck you? (politely)
18,bootlace,When i press this it makes my pee pee happy
19,bootlace,When i press this i let out a bit of wee
20,furious-soldier,SCOTLAND IS NOT A REAL COUNTRY! YOU ARE AN ENGLISHMAN WITH A DRESS!
21,furious-soldier,YOU'RE DEAD. THAT'S GOOD. AMEN.
22,furious-soldier,used to facebook & tweet then i took a g+ arrow in the knee
23,furious-soldier,"Beep boop,son.. beep boop"
24,furious-soldier,I THOUGH BITCHES LOVED A GUY WITH A HUGE HELMET
25,typical-madist,madist
26,typical-madist,madist
27,typical-madist,madist
28,typical-madist,madist
29,typical-madist,madist
30,novia-obsesiva,"squeezes your balls tell me who she is,or they get ripped off"
31,novia-obsesiva,"hello, i don't know you yet"
32,novia-obsesiva,Hey tu!deja de espiar a mi novio es solo mio entendistes!?
33,novia-obsesiva,I dONT CARE WHAT YOU SAY TO ME i WILL NEVER HATE YOU
34,novia-obsesiva,You have to choose me or meme
35,hasidic-jewish-plumber,free bacon moral dilemma
36,hasidic-jewish-plumber,I torah ligament reaching under your sink
37,hasidic-jewish-plumber,Got any jew in your pipes? Want some?
38,hasidic-jewish-plumber,damage the pipes blame the raccoons
39,hasidic-jewish-plumber,steal stuff from clients blame the raccoons
40,crying-dawson,cindy brady grew up to become a right wing whacko islamophobe  racist
41,crying-dawson,SomeboDy Paged mY beeper No change for a pay phone
42,crying-dawson,The modem woke my parents up now I can't fap
43,crying-dawson,NASA puts rover on mars Still can't find where he parked
44,crying-dawson,my glass slippers got too slippery and then prince charming was a cholo
45,powerbrett,YOU GOT IT
46,powerbrett,whitney rocks
47,powerbrett,nice try payner
48,powerbrett,i make everything better
49,powerbrett,both
50,villain-cat,"Now I, Carl, will have all the blue slippers! MUWHAHAHAHAHAHAHAHa"
51,villain-cat,guards! take him to   detroit!!
52,villain-cat,#YOLO Challenge accepted
53,villain-cat,i've been xpekting u... mr. bond
54,villain-cat,amuse  overlord   cat
55,courage-dwight,this meme is shit
56,courage-dwight,this meme is shit fact
57,courage-dwight,Whatever doesn't kill you just makes you stronger. false. it brings you closer to your death
58,courage-dwight,Mr. Dewey plays frisbee? False... The term frisbee is trademarked by wham
59,courage-dwight,“Pain is weakness leaving the body” False: Often there is a simple physiological explanation such as arthritis or blunt trauma
60,unimpressed-queen-elizabeth,YORO You only reign once
61,unimpressed-queen-elizabeth,Wait.... No Quidditch?
62,unimpressed-queen-elizabeth,What? No Quidditch?
63,unimpressed-queen-elizabeth,Unleash The Corgis
64,unimpressed-queen-elizabeth,The Doctor  was meant to light the beacon
65,animal-crossing,Shakes tree piano falls out
66,animal-crossing,Neighbor moves Takes house with them
67,animal-crossing,"told to write hip message for nook's ""nook's sucks"""
68,animal-crossing,"tom nook says ""plant flowers around the shop"" Plants them by my house"
69,animal-crossing,"leave for a week, ""WOW I didnt recognise you!"" they don't recognise the only human in the town."
70,bentay,have you guys seen my dick?
71,bentay,ARE YOU GOING TO SLEEP? LET ME TOUCH YOUR FEET FOR SIX HOURS
72,bentay,Murphy's house for rumbleball picked first
73,bentay,NEW PHONE BACKGROUND? NEEDS MORE DICK
74,bentay,DATES A GIRL DOESN'T SHOW HER HIS DICK
75,m-shadows,rev laulo kertosäkeen vedin turpaan
76,m-shadows,Batman tuli esinahan alta Vedin turpaan
77,m-shadows,Mitä vittua joni? vedin turpaan
78,m-shadows,Huora pummi röökiä Vedin turpaan
79,m-shadows,A7X IS A MATHEMATICAL FORMULA
80,trollface,hey guys see what happens when you press shift+ like
81,trollface,"Recive long emotional text ""ok"""
82,trollface,I just heard the apple guy died R.I.P. Isaac newton
83,trollface,press f13
84,trollface,I hacked this meme so you can't upvote it
85,dumb-whore-gina-rinehart,There is no monopoly On becoming an internet meme
86,dumb-whore-gina-rinehart,the poors SHOULD PUT MORE EFFORTS in choosing the right dad
87,dumb-whore-gina-rinehart,"when i'm poor, i stop being poor and be rich instead"
88,dumb-whore-gina-rinehart,Thepoor should spend more time working FOR ME
89,dumb-whore-gina-rinehart,How I Became Rich? I worked hard all my life Then my dad died
90,mug-punter,dat ass
91,mug-punter,"cool story bro, tell it again with more words"
92,mug-punter,Blow job? Come on.. No teeth!
93,mug-punter,Nothing To do here
94,mug-punter,Ryan! I want you!
95,typical-nina,"hello, im nina trunova and welcome to jackass"
96,typical-nina,no
97,typical-nina,i didn't know a thumb in the butt was an option until now!
98,typical-nina,OHHH WHAT WAS THAT
99,typical-nina,pulling all the red books out of the library shelves and throw them around is an art project An art project is not harassment
100,el-panchito-dise,acá el wasap de sentral ¿CONOSE LA PROMOSION DE 2 COPAS A 5 EUROS?
101,el-panchito-dise,Todo esto Antes era jungla
102,el-panchito-dise,mow jour lawn? how mush?
103,el-panchito-dise,trabaja catorce horas diarias le regala un movil a su hija y ella enseña las tetas en su fotolog
104,el-panchito-dise,ola hamigos me acabo de conectar a la internet pues
105,advice-edit-button,"Create a new character, they said It will be fun, they said"
106,advice-edit-button,It's the meme that nobody asked for
107,advice-edit-button,Maybe it'll catch on if I just force it harder
108,advice-edit-button,"Unspecified ""it"" is known"
109,advice-edit-button,This isn't even my final form
110,office-space-boss,If you all could not post or talk politics for two days for Christmas That would be Great.
111,office-space-boss,If you could not block my face with the meme That would be great
112,office-space-boss,if you could stop being sick that would be great
113,office-space-boss,If you Could stop being sick That'd be great
114,office-space-boss,"yeah, if you could not scream while playing video games that'd be great"
115,scumbag-willymac,fuck you troll me doing shit on minecraft servers
116,scumbag-willymac,says he stops clicking memes invokes them instead
117,scumbag-willymac,jesus christ invoker is better than sex virgin
118,scumbag-willymac,
119,scumbag-willymac,"Happy birthday cuz, You're the miggity miggity miggity miggity Mac"
120,metalsetlists,new emmure album jd has his aoy in april
121,metalsetlists,has 200 post makes end of the year thread
122,metalsetlists,mayhem fest ends start rumor thread for next mayhem fest
123,metalsetlists,HEARS ABOUT TOUR CREATES THREAD WITHOUT CHECKING FOR OLD ONE
124,metalsetlists,god damn it fonzy
125,i-heard-fifa-13-is-so-real,I heard fifa 13 is so realisitc That howard webb is on manchester united's roster
126,i-heard-fifa-13-is-so-real,I heard FIFA 13 is so realistic that when you play with barcelona the only thing you do is dive on the field
127,i-heard-fifa-13-is-so-real,I heard that Fifa 13 is so Real That iT will better than FIFA 12 and pEople should just Stop making making bad memes about this
128,i-heard-fifa-13-is-so-real,I heard that FIFA 13 is So real That it will be better than FIFA 12 So people should stop making bad memes about what they think is Funny
129,i-heard-fifa-13-is-so-real,I HEARD FIFA 13 IS SO REAL THAT MAN.U WILL ALWAYS COME BACK FROM A GOAL DOWN AND BEAT YOU
130,surprised-hipster,UPSKIRT without panty
131,surprised-hipster,LCD Soundsystem Broke up?
132,surprised-hipster,Here that new hipster joke? Ive got it on vinyl
133,surprised-hipster,What you mean i look like moby
134,surprised-hipster,cute girl at library dating a bro?
135,mauraomhs,joguei uma masterball num pidgey daora a vida
136,mauraomhs,"esqueci meu casaco em casa, vou passar frio daora a vida"
137,mauraomhs,"mandei um sms pra mina há 10 minutos, sem resposta daora a vida"
138,mauraomhs,Joguei um papel de bala no chão curto o caos
139,mauraomhs,Tomei sopa sem assoprar  vivendo no limite
140,god-of-punk-rock,"All aboard the rape train Next stop sodomy, Population: Ryan"
141,god-of-punk-rock,gods of punk rock ready for war on the mainstream
142,god-of-punk-rock,death to all butt metal!!!!
143,god-of-punk-rock,PUNK ROCK FTW WHY AM I SHOWING THE METAL SIGH
144,god-of-punk-rock,brendan anthony  is my stage name
145,meanie-melanie,"peas are touching mashed potatoes ""my dad raped me"""
146,meanie-melanie,Boyfriend spending time with sick grandma.. Pulls the plug.
147,meanie-melanie,wants a perfect guy is a slut
148,meanie-melanie,Finds texts from another girl on boyfriends phone cuts his dick off.
149,meanie-melanie,Dad doesn't buy her new car tell mom he's cheating
150,fryshi,NOT SURE IF BAD MEME OR JUST UNDERLYING JOKE THAT ONLY MORTAL KOMBAT PLAYERS UNDERSTAND
151,fryshi,NOt sure if ninja or just blindfolded
152,fryshi,I SEE NOTHING... BUT I SENSE THE SOUND OF JIGGLY TITS!
153,fryshi,HELP  I CAN'T SEE
154,fryshi,Not Sure IF OP Or OTher Characters Just suck
155,clown-trololo,6
156,clown-trololo,"We're not your little brother, we have our own team to worry about.  A reporter sez he's a hok fan?  20 page thread on cyfan!"
157,clown-trololo,No one wants to hire your hillbilly coach Give him a lifetime contract
158,clown-trololo,"Gets butthurt when people make fun of my butthurt accuse them of being butthurt, and it all goes away!"
159,clown-trololo,Hates Iowa fans because they didn't actually go to iowa Dmacc drop out
160,bipolar-owl,"""your illness is an excuse!"" of course it is. i love exposing myself as a psychiatric patient."
161,bipolar-owl,"""WHY DID YOU DO THAT?"" I DON'T KNOW, IT MADE SENSE BACK THEN"
162,bipolar-owl,listen to one song for three months
163,bipolar-owl,i sabotage my life to justify depression
164,bipolar-owl,Depression: I can't talk to anyone about anything Mania: Let me tell grandma all about my sex life
165,neil-degrasse-tyson-reaction,MASS IS NOT  WEIGHT
166,neil-degrasse-tyson-reaction,WATCH OUT GUYS WE'VE GOT A QUARTER CENTURION  IN THE HOUSE
167,neil-degrasse-tyson-reaction,watch out those niggas know they science
168,neil-degrasse-tyson-reaction,sea levels about... this high
169,neil-degrasse-tyson-reaction,watch out we've got a political discussion on facebook over here
170,joelkahn,ASKS IMPORTANT QUESTION CHECKS PHONE INSTEAD OF LISTENING TO ANSWER.
171,joelkahn,need glassware use mason jars
172,joelkahn,Does it have a pink bathroom? i'll take it
173,joelkahn,"need new profile pic quick, dress up like ""Whistler's Mother"""
174,joelkahn,You have a story? He has a better one.
175,strong-independent-black-woman-asdfghjkl,"Georgia be like ""oh snow, you didn't"""
176,strong-independent-black-woman-asdfghjkl,you can call me a bible thumper if you like  your snobbish ridicule is not going to change what i believe
177,strong-independent-black-woman-asdfghjkl,getting pregnant always gots time for dat
178,strong-independent-black-woman-asdfghjkl,"I DON'T HEAR A PEEP FROM YOU ON FACEBOOK... UNTIL I UNFRIEND YOUR ASS, THEN ALL OF A SUDDEN YOU GOT SOMETHING TO SAY?"
179,strong-independent-black-woman-asdfghjkl,not all cops are bad only the bad cops are bad
180,bad-factman,robin! Dont put the batcave's location on facebook!
181,bad-factman,fail tier crap
182,bad-factman,wait we only live once?!
183,bad-factman,Wait wait wait... Avengers has generated HOW much already?!
184,bad-factman,I Cant fap to that!
185,epic-meal-time,jack daniels in your cap'n crunch smart
186,epic-meal-time,NEXT TIME WE EAT YOUR DOG
187,epic-meal-time,Walrus Deep Fried In Chocolate Sauwce Smart
188,epic-meal-time,Next time... we eat Pencils
189,epic-meal-time,"Saussbaussbeard whatchu know bout that, hater?!"
190,crybmxguy,Хочу взять у друга защиту учу высокий банник
191,crybmxguy,MTB
192,crybmxguy,Sylvimor is very proud of all of you
193,crybmxguy,mike's bikes wtf was this for again?
194,crybmxguy,never forget the mastur
195,socially-awkward-tyler,"She said ""hi"" She's my new GF , yo!"
196,socially-awkward-tyler,"I Don't Know If I Should be telling you this, but we're in the same bio class"
197,socially-awkward-tyler,"I DON'T KNOW IF I SHOULD BE ASKING YOU THIS,  BUT DO YOU WANNA HANG OUT LATER?"
198,socially-awkward-tyler,i dont know if i should be asking this but do you wanna hang out later?
199,socially-awkward-tyler,i dont know if i should  be telling you this but t swift is my fave.
200,sixth-sense,I see drunk people And they talk to me
201,sixth-sense,i see people's farts
202,sixth-sense,i see people drinking hot chocolate in June!
203,sixth-sense,i see brazilian people all the time
204,sixth-sense,I See People who listen to pop music
205,rhyming-nemesis,"Just got laid, Crack out the  Cigars."
206,rhyming-nemesis,I LOVE CHOCOLATE BARS
207,rhyming-nemesis,sorry I haven't watched Veronica MARS!
208,rhyming-nemesis,survivors gave me a beating seeing stars
209,rhyming-nemesis,WHERE ARE MY COOKIE JARS?
210,hipster-kitty,Burned mouth ate pizza before it was cool
211,hipster-kitty,i complained about facebook before it changed
212,hipster-kitty,I was a christian b.c.
213,hipster-kitty,I liked Twilight When it was still  the refraction of light around the earth's atmosphere
214,hipster-kitty,Likes justin bieber because hating him is so mainstream
215,mystery-manor-player,DO YOU NOT FIND ME ATTRACTIVE? OR ARE ALL HOLDEN DRIVERS GAY?
216,mystery-manor-player,IK BEN ZO'N DOMME TRUT DIE DOOR EEN BRIL INTELLIGENT WIL LIJKEN
217,mystery-manor-player,MM Friends  Fanpage
218,mystery-manor-player,я вернусь
219,mystery-manor-player,BATTAGLIE MM FRIENDS
220,rosadamente-obvio-o-es-muy-tonto-lo-que-estoy-diciendo,Si esta u era mejor que COLO
221,rosadamente-obvio-o-es-muy-tonto-lo-que-estoy-diciendo,then i told him.... no honey. having an illest tatoo and a sticker on your car doesn't make you look gay at all!
222,rosadamente-obvio-o-es-muy-tonto-lo-que-estoy-diciendo,SEGÚN LAS MADRES LA U ES MEJOR QUE EL COLO ENTONCES POR QUE NO TIENEN LIBERTADORES O ES MUY TONTO LO QUE ESTOY DICIENDO
223,rosadamente-obvio-o-es-muy-tonto-lo-que-estoy-diciendo,CUANTOS DÍAS TIENE UN AÑO BISIESTO? O ES MUY TONTO LO QUE ESTOY DICIENDO?
224,rosadamente-obvio-o-es-muy-tonto-lo-que-estoy-diciendo,ME SAQUE LA CONCHATUMADRE O ES MUY FLETO LO QUE ESTOY DICIENDO
225,bandit-keith,Russia would be a lot better If it was AMERICA
226,bandit-keith,Try speaking american it's the only language i understand
227,bandit-keith,this post was not made in america  it must be destroyed
228,bandit-keith,Let me show you my big american penis in america
229,bandit-keith,silence i kill you  In America
230,anakin-skywalker,from my point of view the democrats are evil
231,anakin-skywalker,From my point of view Fluffy white kittens are evil!
232,anakin-skywalker,"They text me ""plz"" because it's shorter than ""please"" I answer ""no"" because it's shorter than ""yes."""
233,anakin-skywalker,you underestimate my power
234,anakin-skywalker,Message to 2016: you will not take carrie fisher from me
235,not-today-arya,What do we say to apple ios update? Not today
236,not-today-arya,What do we say to Windows 10? Not today!
237,not-today-arya,What do we say about cleaning the kitchen? Not today!
238,not-today-arya,What do we say to people we owe money? Not today!
239,not-today-arya,What do we say to Java applets not today
240,kool-kian,hates Eamon hangs out with him more than he does with anyone else
241,kool-kian,guys let's watch some skins
242,kool-kian,begins conversation with a friend gets out his sheet of notes
243,kool-kian,Is named Kian is cool
244,kool-kian,Drinks some juice spills some of it
245,kag-knight,dUMBass standing in team door blueluigi rages!
246,kag-knight,MOVE!      MOVE!         MOVE! MOVE!      MOVE!         MOVE!
247,kag-knight,Someone dies always wilhelm
248,kag-knight,Sits in spike pit all day Wont build bomb workshop
249,kag-knight,"Noburu is gay ""Noburu likes this"""
250,tardar-sauce,What got problem?
251,tardar-sauce,Jimmy Crack Corn I don't care
252,tardar-sauce,good
253,tardar-sauce,Merry christmas and shit
254,tardar-sauce,HUMBUG
255,walter-sobchak,do as i say not as i do
256,walter-sobchak,Motherfucking apes Took my balls
257,walter-sobchak,stfu you're otta your element
258,walter-sobchak,"shut the fuck up, dawnie"
259,walter-sobchak,since when have there been   walter memes? Donnie! you're out of your element here
260,brians,PASA POR EL CALLAO POR PRIMERA VEZ LOS MARAS SALVATRUCHA LO VIOLAN Y LO MATAN
261,brians,CONTRATA UNA PROSTITUTA ERA UN TRAVESTI
262,brians,FIRST TIME HAS PHONESEX GETS AIDS
263,brians,just drunk texted a girl friendzoned
264,brians,MANDA SU PRIMER SOLICITUD DE AMISTAD  NO LO ACEPTAN Y APARTE LO REPORTAN
265,snow-fall,looks like seifer if he was gay gets socked by post
266,snow-fall,wants your virginity?!! steelguard
267,snow-fall,Sorry for party rocking Get it? Because I have this stone? Aww nevermind...
268,snow-fall,This stone is magic! The guy at the pawn shop said so!
269,snow-fall,"This is how small my dick is. Impressive, I know."
270,joel-poliglota,"SHA LA LA LA LA COMO I WANT LOVE YOU , LOVE YOU , LOVE YOU  STOP DE BRINCAR WITH O MEU  HEART , OH NOO, OHH NOO"
271,joel-poliglota,SE STAY DE CAOZADA THE PORRADA EAT
272,joel-poliglota,50 TONS OF THE  JOEL POLYGLOT GRAY
273,joel-poliglota,FB GIVE ME THE PAPO AND DO THE TOUCH IN THE LITTLE RADIO
274,joel-poliglota,is the impact of my saco beating in your bunda pumba la pUMBA
275,ted-fuck-you-thunder,Fuck you chargers! You can suck my dick!
276,ted-fuck-you-thunder,fuCk you thunder you can sUck my dick
277,ted-fuck-you-thunder,fuck you lynfield  you can suck my dick
278,ted-fuck-you-thunder,fuck you sat's! You can suck my dick!
279,ted-fuck-you-thunder,fuck you ceiling fuck you
280,comical-ali,There are no Russian troops in crimea
281,comical-ali,The Palisades Nuclear plant is safe. There is no concern for alarm
282,comical-ali,"Spyware, Adware, Trackware in Facebook?  This is all lies... The NSA have checked...  and told us so."
283,comical-ali,And the Oscar for Best Picture goes to La La Land
284,comical-ali,SELL OUT SATURDAY WAS A SUCCESS SCOTTISH FOOTBALL DOESN'T NEED RANGERS
285,uncle-dolan-pls,i like what you're doing down there
286,uncle-dolan-pls,PLZ SUK MAI PINIS SANKS U
287,uncle-dolan-pls,Boner pls
288,uncle-dolan-pls,why does this meme even exist?
289,uncle-dolan-pls,Davidav pls
290,hilarious-suitcase,What
291,hilarious-suitcase,What
292,hilarious-suitcase,What
293,hilarious-suitcase,Suspen... pen! pen! pen!
294,hilarious-suitcase,Who put me... ...at the top of towers!
295,only-then-you-have-my-permission-to-die,and now that your dinner is finished you have my permission for pie
296,only-then-you-have-my-permission-to-die,You must do exactly as you are told only then you have my permission to orgasm
297,only-then-you-have-my-permission-to-die,Only when i give that bitch a shark you have my permission to love it
298,only-then-you-have-my-permission-to-die,You Merely adapted to the rain I was born in it
299,only-then-you-have-my-permission-to-die,"When you,ve failed your exam you´ll have my permission to cry"
300,arnaldo-tirone,Se eu gosto do Juquinha? Gosto! até imitei o corte de cabelo
301,arnaldo-tirone,SÓ VIREI PRESIDENTE PORQUE O ARTHURM ABRIU TÓPICO PELA ELEIÇÃO DO NOBRE
302,arnaldo-tirone,huck até que é bom jogador acho que pode ser viável
303,arnaldo-tirone,"não continuem tirando a concentração do skull, o clube do bolinha pode ser fechado por pedido de sua mãe de novo"
304,arnaldo-tirone,eu tenho cara de pernilongo com hemorragia interna
305,clinically-insane-scene-girl,I'm a vegan because meat is murder has had 3 abortions
306,clinically-insane-scene-girl,I don't like living in this country Doesn't know shit about politics
307,clinically-insane-scene-girl,fake death ruin family's lives
308,clinically-insane-scene-girl,I LOVE KIRBY! He's my favorite Pokemon!
309,clinically-insane-scene-girl,raves are awesome born in the 90's
310,baking-kanye,no one man should have all that flour
311,baking-kanye,"CHOCOLATE CHOCOLATE, NIGGAS JUS STOP IT  EVERYBODY KNOWS IMA MUTHAFUCKIN'  FROSTER"
312,baking-kanye,"chocolate, chocolate, nigga just stop it everybody knows i'm a motherfuckin froster"
313,baking-kanye,"24/7, 365 cookies stay on my mind"
314,baking-kanye,yeasty taught me
315,art-history-hedgehog,"studying ""the last supper"" in lecture. non"
316,art-history-hedgehog,mention lack of chinese art history coure classmate suggests anime club
317,art-history-hedgehog,"baroque painting too empty, boring, or serious? /insert putti"
318,art-history-hedgehog,Have copious knowledge of italian language resist urge to properly pronounce names of renaissance artists to avoid sounding pretentious
319,art-history-hedgehog,"mythology professor calls bernini a ""renaissance"" sculptor drop class"
320,xenis,"please donate! i'm raising money for the local animal shelter! ...and by ""animal shelter"" i mean ""my honeymoon"""
321,xenis,talked to someone at event bffs
322,xenis,"go to a store where they stock your brand refer to employees as ""your staff"""
323,xenis,makes self skinny in photoshop it's art!
324,xenis,shrinkle's friends gotta catch em all
325,maniac-pit-bull-terrier,"I'M A PIT BULL TERRIER SO, I'LL START KILLING YOU nOW"
326,maniac-pit-bull-terrier,IS A PIT BULL TERRIER KILLS EVERYONE
327,maniac-pit-bull-terrier,My owner named me mr 305... Mr worldwide! don't like it! so joggers beware!
328,maniac-pit-bull-terrier,I love children... To eat!!!!
329,maniac-pit-bull-terrier,YOU'RE GONNA LEAVE YOU'RE STAFFY WITH ME? YEAH GOOD LUCK WITH THAT
330,typical-ciel,Ciel
331,typical-ciel,Ciel
332,typical-ciel,Ciel
333,typical-ciel,Ciel
334,typical-ciel,Ciel
335,sassy-louis,guurrll you really think harry would fuck you?
336,sassy-louis,i'll take that carrot and shove it up your ass
337,sassy-louis,Bitch please my ass is better than yours
338,sassy-louis,I WOULD CALL YOU A HORSE BUT THAT WOULD INSULT HORSES
339,sassy-louis,BITCH PLEASE I'M LOUIS TOMLINSON
340,tony-liu,"opens incognito window ""anal tranny tentacle rape hentai"""
341,tony-liu,"i play cod on saturday's lol jks, i go to northshore"
342,tony-liu,im chinese. theres no way they can tell im stoned
343,tony-liu,YOU KNOW YOURE A FAGGOT IF YOURE THIS FUCKING UGLY
344,tony-liu,YOU KNOW YOURE A FAGGOT WHEN YOURE THIS UGLY
345,racist-dog-1,What's white on top and black on bottom? Society.
346,racist-dog-1,If we came from wolves why do wolves still exist?
347,racist-dog-1,why dont black people go on cruise's? they arent falling for that one again
348,racist-dog-1,I am not racist. My best friend was black but then my father sold him
349,racist-dog-1,"remember, Racism is a crime! and crime is for niggerz"
350,build-with-blu,Nuthin funny bout folding houses
351,build-with-blu,"Wait!  I thought this was PHILANTHROPY,"
352,build-with-blu,"Housie dezigns, check housie factories, check now where do we buy customers"
353,build-with-blu,I'm slowly working up the courage To wear corbu glasses
354,build-with-blu,Silly modular peps ship house in 4 empty boxes we can do that in 2 empty boxes
355,vengeance-dad,my kids asked if god was real i helped them find the answer
356,vengeance-dad,My family is a treasure THEY CAN ONLY BE FOUND WITH A SHOVEL AND MAP
357,vengeance-dad,they wanted skyrim i showed them oblivion
358,vengeance-dad,She didn't bring me a sandwich i didn't bring her to the hospital
359,vengeance-dad,They told me i would miss my family i never miss at close range
360,fucked-up-flynn,Tell Rovner I'm Fine. He Worries.
361,fucked-up-flynn,Dan flynn likes your status
362,fucked-up-flynn,Eye Que Ow
363,fucked-up-flynn,A REAL MAN LOVES HIS WOMAN EVERY DAY OF THE MONTH
364,fucked-up-flynn,NICKEL BACK
365,doojoon,Whether it rains or snows we love you B2uties
366,doojoon,SURPRISE!! BUTTSECKS
367,doojoon,cLUBS YOU SAY??? gET THE FUCK OUTTA HERE BRACKERZ YA NIGGER
368,doojoon,You mad?
369,doojoon,How You Politely Get People Away From U Wile Dancing
370,love-lace,Baby I was fired from the gap. Wanna make out?
371,love-lace,Baby I took off my grad ring
372,love-lace,Baby Did heaven lose an angel? CUz ima kill you with mY tongue
373,love-lace,would you be more comfortable if i fingered you first then called you  baby?
374,love-lace,baby it will only hurt once
375,perro-huaso,"choreza querido estas partiendo, ojala no partas como el zorron que dejo al holy con el culo ardiendo"
376,perro-huaso,"bestianegra deja los panes ya te pillaron con el pesho comiendose en los cerros mas encima comes pan, pan lleno de carne de perro"
377,perro-huaso,brindo dijo un bipolar mejor no brindo naa
378,perro-huaso,Brindo por el marco y james que se dan como caja cuando salen uyuiiiii
379,perro-huaso,Brindo por el vino y por painepam aunque toma del weno lo vomita igual
380,doctorcynic,"Looks like some people have a bad case of ""taking the internet too seriously"""
381,doctorcynic,Patient thinks they know their own body Yeah Right!
382,doctorcynic,I'm not a doctor but I play one on MFP
383,doctorcynic,NOT DOCTOR PLAYS ONE ON MFP
